Id,unique_id,Article title,Document type,Content type,Article Date,Publication,Source page no,Source link,Gale ID,Source access date,Archive,Excerpt,Permissions
Eng. Lit. Expands (1969-12-04),apdp.cite.000260,Eng. Lit. Expands,Book Review,Newspaper,1969-12-04,The Times Literary Supplement,p. 1381, https://link.gale.com/apps/doc/EX1200363078/GDCS?u=linc74325&sid=GDCS&xid=e00b1378,GALE|EX1200363078,2020-01-23,"""The Times Literary Supplement Historical Archive,""","[Excerpt]: ""...In Africa, what is past or passing or to come makes up the contemporary community: and the modern African writer often reacts violently against it. Wole Soyinka in his plays belabours it like a latterday Yeats dethroning Irish nineteenth-century political rhetoric; George Awoonor-Williams in his poems hopes for a continuation of its wisdom in a materialistic rootless society; the late Christopher Okigbo measured the loss, the complete cancelling out. In Chinua Achebe's profound novels comes the most skilful handling of the theme: the bridging of time between village and city, all illuminated with a variety of tone, a subtlety of speech, which is only now being recognized, and which needed the critical understanding of John Pepper Clark, the Nigerian dramatist, to make the social nuances of its characters clear to the non-African reader...""",
At the crossroads of cultures (1975-10-17),apdp.cite.000261,At the crossroads of cultures,Book Review,Newspaper,1975-10-17,The Times Literary Supplement,p. 1227, https://link.gale.com/apps/doc/EX1200409222/GDCS?u=linc74325&sid=GDCS&xid=eb4d10e3,GALE|EX1200409222,2020-01-23,"""The Times Literary Supplement Historical Archive,""","[Excerpt]: Nadine Gorimer reviews Chinua Achebe's collection of essays Morning Yet on Creation Day. ""Named by Christianized parents after Queen Victoria's beloved; master of the colonial master's tongue, splendidly appropriating it to interpret his country's and people's past; bold user of freedom won by Africa against white domination; Albert Chinualumogu became Chinua Achebe is himself the definitive African experience... Alternatively, there are writers who regard the category ""African writer"" (with its concomitant, African critic?) as a patronizing relegation to literary provincialism. Achebe quotes Nigeria's finest poet, Christopher Okigbo: ""There is no African literature. There is good writing and bad writing--that's all."" ...""",
New Africana from Evans (1973-03-02),apdp.cite.000262,New Africana from Evans,Advertisement,Newspaper,1973-03-02,The Times Literary Supplement,p. 234, https://link.gale.com/apps/doc/EX1200387886/GDCS?u=linc74325&sid= GDCS&xid=86470ebf. ,GALE|EX1200387886,2020-01-23,"""The Times Literary Supplement Historical Archive,""","""Christopher Okigbo. Michael Wade. The first major study of the writing of the well-known Coloured South African novelist."" ",
African Writers Series reaches 100 (1972-02-25),apdp.cite.000263,African Writers Series reaches 100,Advertisement,Newspaper,1972-02-25,The Times Literary Supplement,p. 208,https://link.gale.com/apps/doc/EX1200379210/GDCS?u=linc74325&sid=GDCS&xid=12397335,GALE|EX1200379210,2020-01-23,"""The Times Literary Supplement Historical Archive,""","Advertisement for the African Wrtiers Series; list of the first 100 publications. ""The 100th title in this world-famous paperback series, Girls at War, short stories by Chinua Achebe is published on 28th February at 30p. Achebe has been Editorial Adviser to the series since it began in 1962 with his Things Fall Apart. The ten years between has seen the flowering of African writing, and the best of this--fiction, poetry, and drama--is in this series.""",
A change of address (2002-01-25),apdp.cite.000264,A change of address,Book Review,Newspaper,2002-01-25,The Times Literary Supplement,p. 25, https://link.gale.com/apps/doc/EX1200507640/GDCS?u= linc74325&sid=GDCS&xid=eb82ab4f.,GALE|EX1200507640,2020-01-23,"""The Times Literary Supplement Historical Archive,""","[Excerpt]: Robert Potts reviews Geoffrey Hill's Speech! Speech! ... ""One of the students whom Geoffrey Hill taught at Cambridge (1981-8) used to quote his tutor in letters to friends... Reading Geoffrey Hill can itself feel like receiving a reading list--one is frequently referred to texts and events with which one is unhappily unfamiliar--but the matter of Hill's 'difficulty' (his pun in The Triumph of Love, that he is 'charged with erudition', did little to allay criticism of his range of references) has surely been adequately dealt with, not least by the poet himself... The writers Chinua Achebe and Christopher Okigbo, variously alluded to, both worked for Nigerian radio before the Befran conflict, sinister and exemplary details of which are found throughout Speech! Speech! ...""",
Contents (2010-11-05),apdp.cite.000265,Contents,Advertisement,Newspaper,2010-11-05,The Times Literary Supplement,Table of Contents, https://link.gale.com/apps/doc/EX1200554718/GDCS?u=linc74325&sid=GDCS&xid=bec6e688. ,GALE|EX1200554718,2020-01-23,"""The Times Literary Supplement Historical Archive,""",Obi Nwakanma. Christopher Okibo 1930-67 - Thirsting for sunlight.,
The people who are Africa (2010-04-02),apdp.cite.000266,The people who are Africa,Book Review,Newspaper,2010-04-02,The Times Literary Supplement,p. 5, https://link.gale.com/apps/doc/EX1200553362/GDCS?u= linc74325&sid=GDCS&xid=5c130bfc,GALE|EX1200553362,2020-01-23,"""The Times Literary Supplement Historical Archive,""","[Excerpt]: ""Chinua Achebe is often called the father of the modern African novel, as Bernth Lindfors attests in the introduction to Early Achebe, his perceptive collection of essays on Achebe's output between 1951 and 1966. While this praise may seem exaggerated, it is not unwarranted -- though to regard Achebe's first and most famous novel, Things Fall Apart, published in London in 1958, as an ""African"" novel only underplays its status as one of the most influential post-war novels in English, one that still possesses the power to startle the reader with its vivid description of a complex society in the throes of momentous change. It was the first in the African Writers Series, the Heinemann Educational Books project that revolutionized the field of of anglophone African writing by providing literature for African readers by African writers.... Ike Osodi, the journalist character in Anthills of the Savannah (modelled in part on Achebe's late poet-fighter friend Christopher Okigbo), is a spokesman for this middle ground..."" ",
The Times Diary: Poetic Justice (1969-09-03),apdp.cite.000267,The Times Diary: Poetic Justice,Critical Article,Newspaper,1969-09-03,The Times,p. 10,https://link.gale.com/apps/doc/CS168522019/GDCS?u=linc74325&sid=GDCS&xid=c33eaa0c,GALE|CS168522019,2020-01-23,The Times Digital Archive,"[Full text]: ""The prosaic difficulties of a troubled world have complicated work on an international reference book on poets who write in English. With a preface by the Poet Laureate, C. Day Lewis, Contemporary Poets of the English Language is the first book on the subject for more than 10 years and the only one to include non-white poets from Asia and Africa: it will be published in October by The St. James Press of Chicago and London. Its American editor-in-chief, Mrs. Rosalie Murphy, says she ran into many problems. In Nigeria, the questionnaire sent to Wole Soyinka was not passed on to him in prison, where he has been for two years; while the entry on Christopher Okigbo had to be dropped after Mrs. Murphy had confirmed a report that he had been killed in the civil war. Then there were many black South African poets who have escaped from or otherwise left the country and still move from place to place: Bloke Modisane, believed to have left South Africa on foot in 1950, was traced to London. Minor racial complications occurred in this country, too. Most poets from Wales put down ""Welsh"" as their nationality, although some admitted to ""Anglo-Welsh."" Most Scots preferred ""British,"" while some northern Irish put ""British-Irish."" In America, nearly all Negroes called themselves ""Black,"" although LeRoi Jones added exotically ""African-American-Ancient Egyptian."" ",© Times Newspapers Limited.
The arrest of Ken Saro-Wiwa (1993-07-02),apdp.cite.000268,The arrest of Ken Saro-Wiwa,News Report,Newspaper,1993-07-02,The Times Literary Supplement,p. 16, https://link.gale.com/apps/doc/EX1200179830/GDCS?u=linc74325&sid= GDCS&xid=a0a27a12. ,GALE|EX1200179830,2020-01-23,"""The Times Literary Supplement Historical Archive,""","[Excerpt]: ""At three o'clock on the afternoon of June 21, the President of the Nigerian Association of Writers, Ken Saro-Wiwa, was arrested in Port Harcourt, and has been held incommunicado ever since. He had long been expecting such a move against him. He had also long had doubts about the value of literature as a vocation in a social and political situation as critical as Nigeria's. For the past two years, he had devoted himself to promoting the interests of the Ogoni people, the ethnic group to which he belongs... Born in 1941, he attended Umuahia Government College, the school from which many eminent Nigerian writers--Chinua Achebe, Elechi Amadi, Christopher Okigbo among others-- graduated....""",
African Exports (1973-06-27),apdp.cite.000269,African Exports,Book Review,Newspaper,1973-06-27,The Times Literary Supplement,p. 876,https://link.gale.com/apps/doc/EX1200391232/GDCS?u=linc74325&sid=GDCS&xid=417ab0b7. ,GALE|EX1200391232,2020-01-23,"""The Times Literary Supplement Historical Archive,""","[Excerpt]: ""Today the African novelist is established, not only in profusion among O and A level syllabuses within Africa but also in numerous English literature courses in the Western world... Complementing today's easy availability of the work of African authors (Heinemann's excellent 'African Writers Series' has nearly 150 titles to its credit), Evans Brothers have begun publishing a 'Modern African Writers' series... Each volume adopts a similar pattern, with a brief biographical introduction followed by a critical analysis resting on an exploration of the writer's major works. Thus the aim is fulfiled of telling us something about the present state of criticism in African literature as well as about the work of its principal exponents. 'Schools' are rigorously excluded. Short but useful bibliographies (including lists of critical works as well) and indexes (that for the Okigbo volume, compiled by Valerie Chandler, is a model of its kind) compete the books...""",
"A poet in arms (guns, sub-machine 9mm, 1007) (1966-10-30)",apdp.cite.000270,"A poet in arms (guns, sub-machine 9mm, 1007)",News Report,Newspaper,1966-10-30,The Sunday Times,p. 9, https://link.gale.com/apps/doc/FP1800772721/GDCS?u=linc74325&sid=GDCS&xid=0d3c5143.,GALE|FP1800772721,2020-01-23,"""The Sunday Times Historical Archive,""","[Full Text]: ""The 20th century has been sadly short of poets doubling as men of action; the passion of W. B. Yeats and Ezra Pound was confined to the literary fringe of revoution, and only the poets of the Irish and Spanish Republics, Patrick Pearse, and Garcia Lorca, seem fit to be considered in the same breath as Goethe and Byron. Last week's Insight story on running illicit arms to Nigeria (""Gun-running via Birminham"") has, however, produced a contemporary contender for the role, a distinguished Nigerian poet, Christopher Okigbo. Okigbo, a member of the beleagured Ibo tribe from Eastern Nigeria, planned the deal with a French ex-policeman, Paul Favier to transport 1,007 sub-machine guns to defend the Ibo against the ravages of the Hausa tribesmen from Northern Nigeria. After a short stay in Geneva, where the negotiations with Favier took place, Okigbo flew to Rotterdam shortly before an ancient DC 4 took off on its ill-fated flight. Indeed, he was due to travel with the aircraft, but fortuitously changed his mind at the last moment. When the aircraft crashed in Cameroun just north of the Nigerian border two days later, a suitcase and some books belonging to Okigbo were found among the wreckage. CLASSICAL SCHOLAR. Born in 1932, Okigbo was educated at the Ibadan University where he was a classical scholar. After graduation, he became private secretary to the Nigerian Minister of Research and Information, but two years later he left to teach, and eventually represented the Cambridge University Press in West Africa. His poetry, as yet, shows no signs of political commitment. Although in one of his T. S. Eliot-inspired works the refrain reads: ""& the mortor is not yet dry...""; it refers, prosaically, to construction material not weapons of war. But Okigbo has during the last month gathered the raw material for what could, if he writes it, be the first epic poem about an illicit arms deal."" ",© Times Newspapers Limited.
Africa speaks (1972-04-09),apdp.cite.000271,Africa speaks,Book Review,Newspaper,1972-04-09,The Sunday Times,p. 40,https://link.gale.com/apps/doc/FP1801357043/GDCS?u=linc74325&sid=GDCS&xid=1a032368. ,GALE|FP1801357043,2020-01-23,"""The Sunday Times Historical Archive,""","[Excerpt]: ""In the tourist bazaars of Dar es Salaam the most common form of 'native art' is carved wooden animals--elephants, giraffes, crocodiles in smooth black wood which turns out not to be ebony.... Many of their authors will not have faced the question which their unique position asks them; of those that have, a surprising number will turn out to belong to that amazing generation of Nigerians--it includes Chinua Achebe, Wole Soyinka, J. P. Clark, Christopher Okigbo--who made their debuts in the late Fifties and early Sixties. For these writers, examined in detail in Bruce King's Introduction to Nigerian Literature, a consciousness of their own cultural dilemma proved not an inhibition but a spur. Unlike Tutuola, whose imaginatively translated Yoruba foklore owes its richness as much to mistranslation of Yoruba as to a feeling for the adopted language itself, they are constantly aware of their responsibilites... Those who have picked the clearest path are without doubt the Ibo novelist Chinua Achebe and the Yoruba playwright Wole Soyinka. Soyinka is a poet, in love with words, images and myths, whose plays blend in a unique mixture all the rich formal elements of European drama with the haunting complexities of African ritual. The accomodation here between teh two cultures is complete. Gerald Moore's Wole Soyinka is a useful introduction for the student, but of course there is no substitute for reading or, if possible, seeing Soyinka's marvellous plays...""",© Times Newspapers Limited.
Then and Now: A Change of Address (2014-08-08),apdp.cite.000273,Then and Now: A Change of Address,Book Review,Newspaper,2014-08-08,The Times Literary Supplement,p. 16, https://link.gale.com/apps/doc/JRNPWG346447582/GDCS?u=linc74325&sid= GDCS&xid=615e5ca8,GALE|JRNPWG346447582,2020-01-23,"""The Times Literary Supplement Historical Archive,""","[A reprint of Robert Potts's review of Speech! Speech! by Geoffrey Hill.] ""...The writers Chinua Achebe and Christopher Okigbo, variously alluded to, both worked for Nigerian radio before the Biafran conflict, sinister and exemplary details of which are found throughout Speech! Speech! ...""",
Uprooting the malignant fictions (1988-09-23),apdp.cite.000274,Uprooting the malignant fictions,Book Review,Newspaper,1988-09-23,The Times Literary Supplement,p. 1043, https://link.gale.com/apps/doc/EX1200455973/GDCS?u=linc74325&sid=GDCS&xid=a9f68729,GALE|EX1200455973,2020-01-23,"""The Times Literary Supplement Historical Archive,""","[Excerpt]: ""The critical work represented in the selected essays of the South African novelist J. M. Coetzee and the Nigerian author Chinua Achebe is of a new and superior order, mobilizing the best creative and criticla energies of two writers as committed to their craft as they are to exposing what Achebe calls the 'monster of racist habit.' In both cases the critique of a 'white' culture (whether European, American, or South African)--its assu,ptions, blind spots, abuses of language, logic or humanity--is based on a scrupulous examination of evidence, as it emerges within early travel writing, anecdotes, or the work of individual authors who appear to be transmittig the 'truth' of a continent and its indigenous peoples, but are often perpetuating Western conceptual grids... [Achebe's] collection begins with his analysis of Conrad and ends with a tribute to James Baldwin. Along the way there are speeches on broad topics, such as 'The Truth of Fiction' and 'Thoughts on the African Novel,' a personal tribute to Christopher Okigbo, and passing reflections on the present needs of his own society...""  ",
African fiction: a sense of urgency (1976-12-12),apdp.cite.000275,African fiction: a sense of urgency,Critical Article,Newspaper,1976-12-12,The Sunday Times,p. 39, https://link.gale.com/apps/doc/FP1800832656/GDCS?u=linc74325&sid=GDCS&xid= b6e157a9.,GALE|FP1800832656,2020-01-23,"""The Sunday Times Historical Archive,""","[Excerpt]: ""One of NIgeria's most distinguished poets, Christopher Okigbo (sadly killed in action during the Biafran war) declared firmly: 'There is no African literature. There is good writing and bad writing--that's all.' It's an admirable statement, but not the whole story. His friend and fellow Ibo, the novelist Chinua Achebe, leaned perhaps too far the other way: 'It is clear to me that an Africna creative writer who tries to avoid the big social and political issues of contemporary Africa will end up being completely irrelevant.' ...""",© Times Newspapers Limited.
Surveying Yeats from China to Peru (1966-02-10),apdp.cite.000276,Surveying Yeats from China to Peru,Critical Article,Newspaper,1966-02-10,The Times Literary Supplement,p. 99,https://link.gale.com/apps/doc/EX1200340688/GDCS?u=linc74325&sid=GDCS&xid=8a8a1352,GALE|EX1200340688,2020-01-23,"""The Times Literary Supplement Historical Archive,""","[Excerpt]: ""In spite of the Yeats centenary year, there is still plenty to be said about the poet--as these new volumes demonstrate. Some of the Yeats miscellanies reviewed last year in these columns bore the mark of being compiled for an occasion. A first-rate critical or scholarly article, on any great writer, tends to ripen in the critic's or scholar's mind over the years...The Ibadan volume contains a very fine commemorative poem by one of the most brilliant of West African poets now writing in English, Mr. Christopher Okigbo...""",
Books for a Commonwealth: Publishing locally or from London (1962-08-10),apdp.cite.000277,Books for a Commonwealth: Publishing locally or from London,Critical Article,Newspaper,1962-08-10,The Times Literary Supplement,p. 596,https://link.gale.com/apps/doc/EX1200325529/GDCS?u=linc74325&sid= GDCS&xid=c45ce7b6,GALE|EX1200325529,2020-01-23,"""The Times Literary Supplement Historical Archive,""","[Excerpt]: ""The Commonwealth Education Conference, held in Delhi in January of this year, was the first conference to be held at ministerial level where the provision of books was a main item on the agenda. It was clear throughout that the 'less developed' countries regarded the provision of books in the English language as of the utmost importance... More and more Africans are being appointed as local managers of these [publishing] houses, as for instance Chief Solaru (O.U.P.), Christopher Okigbo (Cambridge) or Chief Fagunwa (Heinemann), all established in Ibadan; also a new publishing house has recently been set up in Lagos... But there is also an increasing amount of high-quality creative writing in English--especially in West Africa, where British publishers have acquired some welcome new authors. Thus Heinemann (in their 'African Writers Series') publish the impressive Chinua Achebe; Cyprian Ekwensi is issued by Hutchinson; while Amos Tutuola is now an established name in Faber and Faber's list...""",
In Conversation (1991-03-29),apdp.cite.000284,In Conversation,Advertisement,Newspaper,1991-03-29,The Times Literary Supplement,18,https://link.gale.com/apps/doc/EX1200462274/GDCS?u=linc74325&sid=GDCS&xid=a67b98ee,GALE|EX1200462274,2020-07-27,"""The Times Literary Supplement Historical Archive,""","Full text: ""In the new series of lunchtime literary events, 'In Conversation,' the Ghanaian writer Ama Ata Aidoo will be discussing her latest novel Changes: A love story, with Margaret Busby. It will take place at the ICA on Wednesday, April 10, at 1pm. Tickets are 2.50.""",
ACCA (2008-09-18),apdp.cite.000286,ACCA,Advertisement,Newspaper,2008-09-18,Financial Times,6,"https://link.gale.com/apps/doc/HS2307123681/GDCS?u=linc74325&sid=
GDCS&xid=aba5d356",GALE|HS2307123681,2020-07-27,Financial Times Historical Archive,"Excerpt: ""ACCA is the global body for professional accountants. We offer business-relevant, first choice qualifications to people of application, ability and ambition around the world who seek a rewarding career in accountancy, finance, and management... The names listed below are the successful candidates in the ACCA final exams taken in June 2008."" [Ama Aidoo is among the listed names.]",© The Financial Times Limited. All rights reserved.
"Africa Centre: African Literature, What Shall We Read? (1991-04-12)",apdp.cite.000289,"Africa Centre: African Literature, What Shall We Read?",Advertisement,Newspaper,1991-04-12,The Times Literary Supplement,11,"https://link.gale.com/apps/doc/EX1200178346/GDCS?u=
linc74325&sid=GDCS&xid=31a638d7",GALE|EX1200178346,2020-07-27,"""The Times Literary Supplement Historical Archive,""","Full Text of Ad: ""African Literature: What Shall We Read? A two day conference at the Commonwealth Institute. Friday 12 - Saturday 13 April 1991. Participants include: Ama Ata Aidoo, Cyprian Ekwensi, Chenjerai Hove, Aminata Slow-Fall. For further details please contact: The Literature Officer, Commonwealth Institute, Kensington High Street, London."" ",
Ain't I a woman (1992-12-11),apdp.cite.000290,Ain't I a woman,Book Review,Newspaper,1992-12-11,The Times Literary Supplement,22,"https://link.gale.com/apps/doc/EX1200468728/
GDCS?u=linc74325&sid=GDCS&xid=fbe96eaa",GALE|EX1200468728,2020-07-27,"""The Times Literary Supplement Historical Archive,""","""Ain't I a Woman"" by critic Maya Jaggi reviews ""Daughters of Africa,"" an anthology edited by Margaret Busby. Excerpt: ""Daughters of Africa draws together samples of work by more than 200 women of African descent, from the continent itself to the diaspora... Toni Morrison uses the narrator's voice as chorus, with echoes of black church music and jazz, as does Ghanaian, Ama Ata Aidoo, in her mischievous satires on urban materialism and sexual relations."" ",
Things fall apart (1992-12-11),apdp.cite.000291,Things fall apart,Book Review,Newspaper,1992-12-11,The Times Literary Supplement,22,"https://link.gale.com/apps/doc/EX1200468728/
GDCS?u=linc74325&sid=GDCS&xid=fbe96eaa",GALE|EX1200468728,2020-07-27,"""The Times Literary Supplement Historical Archive,""","In ""Things fall apart,"" critic Rob Nixon reviews the Soho Square V: A collection of new writing from Africa. Nixon writes that the collection ""abandons any pretence at making a representative selection"" with ""twenty-one of the thirty-two contributors"" being from Southern Africa. Excerpt: ""Soho Square V has offerings from some of the leading figures in African literature: a story by Ama Ata Aidoo, an essay by Nadine Gordimer, and a Brutus poem, but they are far from their best.""",
Anowa: The Gate Theatre (1991-04-09),apdp.cite.000292,Anowa: The Gate Theatre,Play Review,Newspaper,1991-04-09,Financial Times,23,https://link.gale.com/apps/doc/HS2304567606/GDCS?u=linc74325&sid=GDCS&xid=cc2df098.,GALE|HS2304567606,2020-07-27,Financial Times Historical Archive,"Malcolm Rutherford reviews Ama Ata Aidoo's play ""Anowa."" Excerpt: ""Some of the touches, like the introductory and closing music, are distinctly West African. But do not go to see Anowa looking for something exotic. What will strike you is not how different it is from developed western culture, but how similar. It is a very well-constructed, thoughtful piece. Anowa is played with superb self-control by Joy Elias-Rilwan, as is Kofi by David Harewood. The play is directed by Dele Charley and was written by Ama Ata Aidoo as long ago as 1970.""",© The Financial Times Limited. All rights reserved.
Channel 4: Book Choice Special (1997-05-08),apdp.cite.000293,Channel 4: Book Choice Special,Radio Schedule,Newspaper,1997-05-08,Financial Times,23,"https://link.
gale.com/apps/doc/HS2305187651/GDCS?u=linc74325&sid=GDCS&xid=9eebd660",GALE|HS2305187651,2020-07-27,Financial Times Historical Archive,"Full Text: ""Channel 4: 7.50 Book Choice Special: A Festival of Commonwealth Literature. With Ghanaian novelist Ama Ata Aidoo, author of Changes.",© The Financial Times Limited. All rights reserved.
Attempting the Pen (1989-09-22),apdp.cite.000294,Attempting the Pen,Book Review,Newspaper,1989-09-22,The Times Literary Supplement,1024,https://link.gale.com/apps/doc/EX1200458581/GDCS?u=linc74325&sid=GDCS&xid=816cde3b,GALE|EX1200458581,2020-07-27,"""The Times Literary Supplement Historical Archive,""","Angela Leighton reviews three anthologies: ""Anthology of British Women Writers,"" ""Longman Anthology of World Literature by Women,"" and ""Dictionary of British Women Writers."" Excerpt: ""Anthologies serve many purposes. They may blaze a trail of new writing, or simply confirm popular tastes of the day. They may change the literary consciousness of an age, or merely look good on the coffee table... A short story by the Ghanaian Ama Ata Aidoo is followed by two poems by the Cuban Cuza Male, and three very funny poems on women and colonialism by the Jamaican Louise Bennett are followed by Doris Lessing's sophisticated satire of male sexism in a short story called 'A Woman on a Roof.' ...""",
