Id,unique_id,Article title,Document type,Content type,Article Date,Publication,Source page no,Source link,Gale ID,Source access date,Archive,Excerpt,Permissions
Among the Magazines (1980-06-06),apdp.cite.000001,Among the Magazines,Book Review,Newspaper,1980-06-06,The Times Literary Supplement,p. 646,http://link.galegroup.com/apps/doc/EX1200429466/GDCS?u=linc74325&sid=GDCS&xid=2bbcdc94,GALE|EX1200429466,2019-07-06,"""Gale Primary Sources Database

Print:""","…and ""Sculptor in prison"", an interview with Pitika Ntuli, the black South African poet and artist, who describes how he coped with the ordeal of solitary confinement in Swaziland. ",
Wayward and wild (2004-09-10),apdp.cite.000002,Wayward and wild,Book Review,Newspaper,2004-09-10,The Times Literary Supplement,p. 32,http://link.galegroup.com/apps/doc/EX1200520023/GDCS?u=linc74325&sid=GDCS&xid=9c8e04de,GALE|EX1200520023,2019-07-06,"""Gale Primary Sources Database

Print:""","Mary married the volatile South African poet Roy Campbell, and had a range of affairs, including with Vita Sackville-West. (""Fancy being cuckolded by a woman!"" was C.S. Lewis's reation when Campbell told him.) ",
Excile in Colechester (2001-08-03),apdp.cite.000003,Excile in Colechester,Book Review,Newspaper,2001-08-03,The Times Literary Supplement,p. 21,http://link.galegroup.com/apps/doc/EX1200505177/GDCS?u=linc74325&sid=GDCS&xid=4c722ff4,GALE|EX1200505177,2019-07-06,"""Gale Primary Sources Database

Print:""","R. N. Currey was born in South Africa in 1907, the chid of a missionary family, and lived there until he went to school in England in 1921. As a result of that circumstance, and a few subsequent visits, he is often claimed as a South African poet.  That his Collected Poems is jointly pubished by David Phillip (Probably the best and certainly the most influential publisher in South Africa) and his son's firm (based in Oxford, but mainly concerned with African material) seems to bear out this claim). ",
Paths to Refinement (1969-07-24),apdp.cite.000004,Paths to Refinement,Book Review,Newspaper,1969-07-24,The Times Literary Supplement,p. 836,http://link.galegroup.com/apps/doc/EX1200360477/GDCS?u=linc74325&sid=GDCS&xid=7be13190,GALE|EX1200360477,2019-07-01,"""Gale Primary Sources Database

Print:""","Both the virtues and weaknesses of the later Christopher Okigbo's poetry are visible in the first collection of his fellow-Ibo and young compatriot Micheal Echeruo….


",
Poetry of the New Lands (1916-02-17),apdp.cite.000005,Poetry of the New Lands,Critical Article,Newspaper,1916-02-17,The Times,p. 11,http://link.galegroup.com/apps/doc/CS186713681/GDCS?u=linc74325&sid=GDCS&xid=cf977bbe,GALE|CS186713681,2019-06-29,The Times Digital Archive,"Turning to South Africa, Sir Hubert said Rudyard Kipling was in a sense a poet of South Africa, the Poet of ""General Joubert"" and the ""Bridge Guard in the Karroo."" and ""Columns"" and ""Piet."" He had consulted Mr. Kipling as to what South African Poetry there was beside his own.
Mr. Kiplig replied, ""It's a case of there's Pringle, and there's Pringle, and there's a lot of good verse, light and half-light, but scattered, and there are the poems in the Taal, part translations and parodies, part original.""
Pringle was the son of a Scotch Border farmer, roughly contemporary with Keats. He acquired a good literary position in Edingurgh and made the friendship of Scott. But literature did not pay, and in 1819 he went out to South African with a Scotch party. He spent some time with them in the bush and then attempted a new iterary career in Cape Town, but quarrelled with the governor, and returning to England threw himsef into the cause of the abolition of slavery. Just when success was reached he died at the early age of 46 in 1834.",© Times Newspapers Limited.
All the Trouble in the World- Dr. Mairi J Blackings comments a bold exploration of the turmoil in Africa (1996-11-02),apdp.cite.000007,All the Trouble in the World- Dr. Mairi J Blackings comments a bold exploration of the turmoil in Africa,Book Review,Newspaper,1996-11-02,Financial Times,p. XVI,http://link.galegroup.com/apps/doc/HS2305174558/GDCS?u=linc74325&sid=GDCS&xid=8b631052,GALE|HS2305174558,2019-06-29,Financial Times Historical Archive, - ,© The Financial Times Limited. All rights reserved.
"Death Of A Moslem Poet: Last ""Minstrel"" Of North Africa (1932-01-21)",apdp.cite.000008,"Death Of A Moslem Poet: Last ""Minstrel"" Of North Africa",Obituary,Newspaper,1932-01-21,The Times,p. 11,https://link.gale.com/apps/doc/CS186197557/GDCS?u=linc74325&sid=GDCS&xid=09193e31,GALE|CS186197557,2016-12-15,The Times Digital Archive,"DEATH OF A MOSLEM POET
LAST ""MINSTREL"" OF NORTH AFRICA
FROM OUR ALGIERS CORRESPONDENT

Just after noon on January 12, almost at the beginning of Ramadan the famous Moslem poet Sheik Benguedda El Hadj Belarbi, died at Mazuna.  He was over 80, and had been il for a long time. For may years he lived at Ain-Morane, where he was the central figure in a group of native chiefs, the descendants of those who had fought in the border battles btween Bu-Maaza, the Sultan of the Dahra and the Warsenis, and Saint-Arnaud and Pelissier. He was the living history of those stirring times.
Later on he came to Mazuna and became the proprietor of a Moorish cafe, which was opened by M.Jules Cambon, then Governor-General of Algeria, and was for many years a place  of pilgrimage for poets from all over North Africa. His chief delight was in long improvisations, for which he relied on his remarkable retentive memory. In his library were to be found nearly all the works of the North African Moslem poets especialy those of Morocco and Western Algeria, and he would readily recite long narrative poems of over 1,200 lines, such as the famous Moslem poems of the seventeenth century. He died poor, having spent nearly all his money in paying scribes to record the traditional Moslem poetry. Wirh him has passed probably the last of those who have long borne the banner of Moslem ministrelsy in North Africa.",© Times Newspapers Limited.
The allusive traditions of Africa (1971-04-23),apdp.cite.000009,The allusive traditions of Africa,Book Review,Newspaper,1971-04-23,The Times Literary Supplement,p. 486,http://link.galegroup.com/apps/doc/EX1200371915/GDCS?u=linc74325&sid=GDCS&xid=fd1e9cb3,GALE|EX1200371915,2019-07-01,"""The Times Literary Supplement Historical Archive,""","Book review of Ruth Finnegan's work; briefly mentions of p'Bitek: ""Clearly, we shall have to move not only towards the acceptance of aesthetic standards in the collection of [African] oral literature but towards the acceptance of two partially separate standards. For the indigenous collector, like Okot p""Bitek of the Acoli or J. H. Nketia of the Adan, a standard based on deep and intimate knowledge of the particular culture and its chief literary artists must be adopted."" ",
Sophiatown Style (1982-08-27),apdp.cite.000010,Sophiatown Style,Book Review,Newspaper,1982-08-27,The Times Literary Supplement,p. 928,http://link.galegroup.com/apps/doc/EX1200162121/GDCS?u=linc74325&sid=GDCS&xid=d506a159,GALE|EX1200162121,2019-07-01,"""The Times Literary Supplement Historical Archive,""","Critic Dennis Walder suggests that Lewis Nkosi in Tasks and Masks is ""particularly persuasive on modern African poetry."" Nkosi cites Ranaivo, Rabearivelo, Rabemananjaro as cosmopolitan Malagasy poets; Walder suggests that these poets ""elicit from Nkosi close and sympathetic attention, and a convincing application of his overall argument - announced at the start as an obsessive idea that African writers are 'easily divisible' into two groups: those who see their society as unchanging, like a mask turned perpetually in the artist's hands, 'each time revealing nothing more than what it is, the work of some skillful carver who originally imparted to it its outstanding features'; and those writers who conceive 'of the act of writing as the carrying out of social tasks'."" Walder writes, ""As Nkosi applies this distinction, the remarkably rich and varied literary manifestations of the continent do begin to fall into a kind of order. And its application enables the critic to proceed to the level of insight which relates the different uses of, for example, traditional Malagasy folk poetry - the so-called hain-teny or proverb formula - by the poets concerned, to their respective personal and class positions: Rabearivelo, the 'deracinated' intellectual whose reworking of the hain-teny conceits read like translation; and Ranaivo, the rediscoverer of his own culture who integrates the hain-teny into his work, thus bringing together 'task' and 'mask'."" ",
Poets from Abroad (1958-06-13),apdp.cite.000011,Poets from Abroad,Book Review,Newspaper,1958-06-13,The Times Literary Supplement,p. 332,http://link.galegroup.com/apps/doc/EX1200313524/GDCS?u=linc74325&sid=GDCS&xid=86bf808e,GALE|EX1200313524,2019-07-01,"""The Times Literary Supplement Historical Archive,""","A short review of the collection Poets in South Africa. Author suggests that ""the insularity of the British"" is emphasized by this collection, as he doubts many would have heard of the poets in the collection. The author suggests that the poets in the collection ""are...a remarkably talented lot with, among them, a few who would be outstanding company, but who are largely unknown outside the Union."" ",
Current Periodicals (1953-02-06),apdp.cite.000012,Current Periodicals,Periodical Review,Newspaper,1953-02-06,The Times Literary Supplement,p. 94,http://link.galegroup.com/apps/doc/EX1200094173/GDCS?u=linc74325&sid=GDCS&xid=ea0dcb4c,GALE|EX1200094173,2019-07-01,"""The Times Literary Supplement Historical Archive,""","Review of a German magazine: ""For readers who are neither Swiss or American, there is something almost incredible about the lavish production of this monthly magazine: founded during the last war, it positively radiates prosperity, of a kind which most of us associate with a past already remote... There are translations of African poetry, of a poem by Mr. Robert Frost and of a story from Mr. Henry Williamson's The Peregrine Saga.""",
Scorning the Sonnet (1983-09-16),apdp.cite.000013,Scorning the Sonnet,Book Review,Newspaper,1983-09-16,The Times Literary Supplement,p. 996,ttp://link.galegroup.com/apps/doc/EX1200442182/GDCS?u=linc74325&sid=GDCS&xid=37c0ed96,GALE|EX1200442182,2019-07-01,"""The Times Literary Supplement Historical Archive,""","Carlin writes of Goodwin's collection: ""The strength of the book is not Ken Goodwin's criticism...but the arrangement and explication of these ten poets according to a scheme which forms a socio-cultural description of African poetry. In this respect, Professor Goodwin is enlightening and instructive, for he places his poets... roughly in the order of their Africanness, their independence of European models."" ",
Publishers are defined by their authors (1983-09-16),apdp.cite.000014,Publishers are defined by their authors,Advertisement,Newspaper,1983-09-16,The Times Literary Supplement,p. 996,https://link.gale.com/apps/doc/EX1200442183/GDCS?u=linc74325&sid=GDCS&xid=f0fe3c96,GALE|EX1200442183,2019-07-01,"""The Times Literary Supplement Historical Archive,""","An advertisement for David Philip, a publisher working with southern African poets and writers. He lists the authors he has published.",
Notes (1917-06-21),apdp.cite.000015,Notes,Event Announcement,Newspaper,1917-06-21,The Times Literary Supplement,p. 298,http://link.galegroup.com/apps/doc/EX1200020886/GDCS?u=linc74325&sid=GDCS&xid=bad9733f,GALE|EX1200020886,2019-07-01,"""The Times Literary Supplement Historical Archive,""","Mr. B. H. Blackwell hopes to publish the following books: ...a new addition to South African poetry by a Lecturer in Philosophy at the University of Cape Town, who now holds a commission in the Machine-Gun Guards.",
From veld-lovers to freedom fighters (1980-11-21),apdp.cite.000016,From veld-lovers to freedom fighters,Book Review,Newspaper,1980-11-21,The Times Literary Supplement,p. 1341,http://link.galegroup.com/apps/doc/EX1200431452/GDCS?u=linc74325&sid=GDCS&xid=b90198f7,GALE|EX1200431452,2019-07-01,"""The Times Literary Supplement Historical Archive,""","Lewis Nkosi reviews the collection of poetry by Guy Butler and Chris Mann. The collection features a multitude of African poets, and has been translated into English for those poets whose language is ""Afrikaans."" This tension is explored by Nkosi, who suggests, ""From the very beginning, English-speaking South Africans have struggled, sometimes fiercely, to forge a new identity out of this double sense of belonging."" Nkosi then mentions poets such as Kunene, Mtsbali, Serote, Gwala, and Sepamla as ""gathered into this poetic enclosure like Zimbabwean freedom fighters brought to makeshift assembly points."" ",
B. H. Blackwell (Forthcoming) (1917-06-07),apdp.cite.000017,B. H. Blackwell (Forthcoming),Book Review,Newspaper,1917-06-07,The Times Literary Supplement,p. 265,http://link.galegroup.com/apps/doc/EX1200020705/GDCS?u=linc74325&sid=GDCS&xid=f05d1581,GALE|EX1200020705,2019-07-01,"""The Times Literary Supplement Historical Archive,""","""A new addition to South African Poetry, by a Lecturer in Philosophy at the University of Cape Town, who now holds a commission in the Machine Gun Guards.""",
I remember it well (1971-06-27),apdp.cite.000018,I remember it well,Book Review,Newspaper,1971-06-27,The Sunday Times,p. 29 ,http://link.galegroup.com/apps/doc/FP1800573735/GDCS?u=linc74325&sid=GDCS&xid=c9f1af23,GALE|FP1800573735,2019-07-01,"""The Times Literary Supplement Historical Archive,""","Connolly's review of Lisbon by David Wright (poet) and Patrick Swift (painter/illustrator) suggests that the two ""collaborate well; Swift provides the expert knowledge and the pleasant drawings, Wright the tourist approach and general picture."" Lisbon is a guide-book on Portugal. ",© Times Newspapers Limited.
Different aesthetics (1990-05-18),apdp.cite.000019,Different aesthetics,Book Review,Newspaper,1990-05-18,The Times Literary Supplement,p. 533,"http://link.galegroup.com/apps/doc/EX1200460361/GDCS?u=
linc74325&sid=GDCS&xid=51c0a06a",GALE|EX1200460361,2019-07-01,"""The Times Literary Supplement Historical Archive,""","Giles Foden presents a review on two Heinemann publications, both featuring African poetry. Of the first, Godhorse, the first poetry collection by Kojo Laing, he writes ""The wit is characteristic, but every poem is different, perhaps the only common thread being the championing of sensory experience, especially in connection with religion. Laing handles surrealism well, and is capable of excellent passages."" Of The Fate of Vultures, Foden suggests that the anthology reflects the great depth of talent and vigour in modern African poetry. Foden quotes Seamus Heaney when he suggests that the poems in the collection 'have the potency of human testimony' and so are difficult to criticize. ",
Haitian High Drama (1964-07-16),apdp.cite.000020,Haitian High Drama,Book Review,Newspaper,1964-07-16,The Times Literary Supplement,p. 633,http://link.galegroup.com/apps/doc/EX1200333739/GDCS?u=linc74325&sid=GDCS&xid=beb6f496,GALE|EX1200333739,2019-07-01,"""The Times Literary Supplement Historical Archive,""","Moore writes, ""Lamine Diakhate's poetry glows with good will and the right political sentiments; it is also something of a technical tour-de-force, for the writer has isolated the tendency of the language towards sonorous emptiness and caried it to the extremes... All the familiar properties of the negritude a la Senegal are here; the nostalgia of the exile, the Ancients with their gnomic wisdom, the long horizons, the rejection of life and the here-and-now in favour of the dim and distant. But the poet fails to handle them with the distinction or originality which alone could make the rehash excusable. A new vocabulary is in desperate need of the younger African poets now writing in French.""",
A garbled message (1990-05-18),apdp.cite.000021,A garbled message,Book Review,Newspaper,1990-05-18,The Times Literary Supplement,p. 533,"http://link.galegroup.com/apps/doc/EX1200460359/GDCS?u=
linc74325&sid=GDCS&xid=7bea388b",GALE|EX1200460359,2019-07-01,"""The Times Literary Supplement Historical Archive,""","Watson compares the two anthologies of African poetry, one compiled by Stephen Gray and the other Jane Watts. Of Penguin's anthology, he writes, ""No work to date so completely misrepresents the full spectrum of poetry from this part of the world, and seems so perversely designed to mislead readers who do not already have extensive independent knowledge of local political and cultural history... Gray claims that all nations of southern African belong to a single 'literary system' whose importance overrides any division of the area into separate nation-states."" Of Watts, Watson has a more positive opinion, in that Watts instead makes the ""essential point"" that the work of black writers in South Africa is ""very different from that of African writers elsewhere."" He then writes that, ""having presented these differences, [Jane Watts] is able to explain with admirable lucidity why black writing in this country has progressively assumed an identity all its own, and most particularly why it no longer conforms to Western aesthetic standards.""",
Effects of exile (1982-05-14),apdp.cite.000022,Effects of exile,Book Review,Newspaper,1982-05-14,The Times Literary Supplement,p. 541,"http://link.galegroup.com/apps/doc/EX1200161850/GDCS?u=
linc74325&sid=GDCS&xid=3e477aa0",GALE|EX1200161850,2019-07-01,"""The Times Literary Supplement Historical Archive,""","Anthony Delius reviews two collections of poetry that both are from poets who have been or are in ""exile."" He suggests that in response to exile, one can become ""critical of the culture left behind"" or ""promote it in the face of the omnipresent pressure of the culture of the place or places of refuge."" Delius suggests that Lenrie Peters' work is more of the first, while Mazisi Kunene's is the second. Delius quotes, ""An African critic has written that 'of all African poets of the English expression, he is the least concerned about his country and most concerned about the fate of the continent as a whole!'"" Meanwhile, ""Mazisi Kunene's 300-page dithyramb is dedicated to all the women of Africa, especially the renowned Zulu women, as well as to a couple of goddesses in the African pantheon... [Kunene] grew up listening to the insolent upholders of 'White Christian Civilization' who claimed that black people were unable to produce a civilization like their own or of any kind. Possibly after nearly thirty years of forced exile, Kunene still feels the need to explode that racist absurdity, as well as express his proper pride in the cultural and religious concepts of the Zulus.""",
Agisymbolic (1966-09-08),apdp.cite.000023,Agisymbolic,Book Review,Newspaper,1966-09-08,The Times Literary Supplement,p. 816, http://link.galegroup.com/apps/doc/EX1200342910/GDCS?u=linc74325&sid=GDCS&xid=f3ec4684,GALE|EX1200342910,2019-07-01,"""The Times Literary Supplement Historical Archive,""","The review entitled Agisymbolic is critical of Janheinz Jahn collection of works; the ""heterogenous material"" included in his book varies from ""Juan Latino, who wrote bad poems in Latin in praise of Spanish noblemen; Langston Hughes pleading for sympathy; Somali poets imitating Arabic ideas of chivalry,"" and so on. The critic is skeptical of Jahn's suggestion that all of ""the black African cultures south of the Sahara form a cultural unit"" and that they can be collectively called Agisymbia. Jahn defines neo-African literature all writing that contains Agisymbian-style elements, but never truly explains what an ""Agisymbian"" element includes. ",
Cruising through hell (1974-10-06),apdp.cite.000024,Cruising through hell,Book Review,Newspaper,1974-10-06,The Sunday Times,p. 35,http://link.galegroup.com/apps/doc/FP1800821524/GDCS?u=linc74325&sid=GDCS&xid=34344baa,GALE|FP1800821524,2019-07-01,"""The Sunday Times Historical Archive,""","Smith writes a review of multiple books, but of C. J. Driver's, he writes: ""The first is by a gifted young South African poet, C. J. Driver. A Messiah of the Last Days is about the involvement between Tom Grace, a successful London barrister, and John Buckleson, an idealistic demagogue who leads a sect called the Free People, dedicated in our old country grown weary of the gruesome political cliches, to the building of a new Jerusalem. It's full of interest, but a touch melodramatic in its denoument.""",© Times Newspapers Limited.
A Poet of South Africa (1947-05-31),apdp.cite.000025,A Poet of South Africa,Book Review,Newspaper,1947-05-31,The Times Literary Supplement,p. 296,http://link.galegroup.com/apps/doc/EX1200281100/GDCS?u=linc74325&sid=GDCS&xid=ad7928cb,GALE|EX1200281100,2019-07-01,"""The Times Literary Supplement Historical Archive,""","The critic writes, of F. C. Slater's poetry collection, ""The selection contains only a few pieces on topics of an abstract kind, aesthetic or philosophical; one of hte few is a generous and curious fancy concerning all the activities and the mutations of the poetic spirit. But the scarcity of such detached reflections is not to be misunderstood; for the whole book is founded in reflective habit and maturity through which the national theme so prominent in it is measured and given its setting in the landscape of all human affairs. The secret of his whole structure is his comprehension of life, thought and art beyond geographical boundaries."" ",
African Poems of Thomas Pringle (1991-02-22),apdp.cite.000026,African Poems of Thomas Pringle,Book Review,Newspaper,1991-02-22,The Times Literary Supplement,p. 8 ,"http://link.galegroup.com/apps/doc/EX1200461917/GDCS?u=
linc74325&sid=GDCS&xid=4c9d3c06",GALE|EX1200461917,2019-07-01,"""The Times Literary Supplement Historical Archive,""","Stephen Watson reviews the poetry collection of Thomas Pringle, who is a Scottish poet considered to be the ""father of South African poetry"": ""On the face of it, the title might seem well-deserved. He was undoubtedly the first of the nineteenth-century colonial poets to take on the general conditions of life in the Colony as his subject matter. Moreover, his poetry's early, often outraged protests against white tyranny, as well as its championing of the dispossessed and maligned black peoples, have made him the obvious founding father of that tradition of protest poetry which has been more or less dominant in South Africa in the past few decades."" Watson writes of Roy Campbell that Pringle fathered few successors of his kind of poetry, and the only ""significant child"" was Campbell, who appears a century later.",
A world reclaimed (2020-11-25),apdp.cite.000027,A world reclaimed,Book Review,Newspaper,2020-11-25,The Times Literary Supplement,p. 1307,"http://link.galegroup.com/apps/doc/EX1200456534/GDCS?u=
linc74325&sid=GDCS&xid=a4b25d13",GALE|EX1200456534,2019-07-01,"""The Times Literary Supplement Historical Archive,""","Karin Barber writes that Chinweizu's anthology, Voices from Twentieth-Century Africa, ""aims to map out by example the true dimensions of the field of African literature."" Barber appreciates Chinweizu's inclusion of traditional orature among literature, but criticizes his ""bypassing the things that a lot of ordinary African people actually read, watch, and listen to.""",
Sunday 6 January: Radio 3 (1995-12-31),apdp.cite.000028,Sunday 6 January: Radio 3,Radio Schedule,Newspaper,1995-12-31,The Sunday Times,p. 51 [S6],"http://link.
galegroup.com/apps/doc/FP1801763386/GDCS?u=linc74325&sid=GDCS&xid=c3d92d3b",GALE|FP1801763386,2019-07-01,"""The Sunday Times Historical Archive,""",9.25 Best Words. A reassessment of South African poet Roy Campbell.,© Times Newspapers Limited.
Radio: Radio 3  (1999-01-24),apdp.cite.000029,Radio: Radio 3 ,Radio Schedule,Newspaper,1999-01-24,The Sunday Times,p. 44 [S10],http://link.galegroup.com/apps/doc/FP1802605661/GDCS?u=linc74325&sid=GDCS&xid=ceeae2c3,GALE|FP1802605661,2019-07-01,"""The Sunday Times Historical Archive,""",10.45 Night Waves. Richard Coles talks to leading South African poet and journalist Antjie Krog; plus the announcement of the Whitbread Book Awards.,© Times Newspapers Limited.
The Bishop's move (1997-06-27),apdp.cite.000030,The Bishop's move,Book Review,Newspaper,1997-06-27,The Times Literary Supplement,p. 24,"http://link.galegroup.com/apps/doc/EX1200487325/GDCS?u=linc74325&sid=
GDCS&xid=608eb866",GALE|EX1200487325,2019-07-01,"""The Times Literary Supplement Historical Archive,""","No particular African poet is mentioned, but, when speaking of literary history, critic Landeg White writes: ""There are moments in literary history (arguably in eleventh-century Andalusia, giving rise to troubadour poetry, demonstrably in modern Africa and Caribbean poetry in English) when popular culture challenges literacy and raises the most basic questions about peotry's subject-matter, forms, language, and means of dissemination; in short, about who poetry belongs to.""",
The Climate of Taste (1953-10-02),apdp.cite.000031,The Climate of Taste,Book Review,Newspaper,1953-10-02,The Times Literary Supplement,p. 628,http://link.galegroup.com/apps/doc/EX1200299442/GDCS?u=linc74325&sid=GDCS&xid=472db479,GALE|EX1200299442,2019-07-06,"""The Times Literary Supplement Historical Archive,""","G. S. Fraser reviews the new anthology, The Faber Book of Modern Verse, which is intended to complement the previous version, the Faber Book of Modern Verse, collected by Michael Roberts. This new anthology was edited by two poets, John Heath-Stubbs and David Wright. Of David Wright, Fraser says: ""...readers of anthologies, however, will have enjoyed both his poems on classical themes and his comic and satirical pieces, which have something of the robustness of similar work by his fellow-countryman, Mr. Roy Campbell.""",
