"airtableID","title","unique_id","Article title","Document type","Article Date (formatted)","[publication]","publisher","Source page no","Source link","Gale ID","Source access date","rights_holder","[archive]","Excerpt","works","[events]","subjects","Tags","Notes","Permissions","[news item roles]","Complete","person","contributor.name","creator.name","topics-decade","commentaries-link"
"recagmVEhJFV288bn","'Bound with Garlands' (1927-07-27)","apdp.news.000405","'Bound with Garlands'","Critical Article","1927-07-27","['recd5QaydfA6Ls4RM']","[""The Sunday Times""]","p. 3","https://link-gale-com.libproxy.unl.edu/apps/doc/FP1801508381/STHA?u=linc74325&sid=bookmark-STHA&xid=d1ce9b20","GALE|FP1801508381","1927-07-27","[""The Sunday Times Historical Archive,""]","['rec5hnSzuyYB34qhu']","""I was brought up to believe that a sonnet was definable.""","[English Sonnets (1947)](apdp.work.000231)","","","[""poetry"", ""criticism"", ""review""]","","© Times Newspapers Limited.","['recEPcUkm9A1Wb2OR', 'recM7Myco12xrkrOp']","True","[Morgan, Charles Langbridge]()|Writer;;;[Campbell, Roy](apdp.person.000514)|Mentioned Poet","[""Campbell, Roy""]","","1920",""
"rec5xbnFD4icRFm0x","'Gory' Gatsby Is Too Violent for US Students (2014-04-27)","apdp.news.000356","'Gory' Gatsby Is Too Violent for US Students","News Report","2014-04-27","['recd5QaydfA6Ls4RM']","[""The Sunday Times""]","p. 24","https://link-gale-com.libproxy.unl.edu/apps/doc/XFZBCX279088978/STHA?u=linc74325&sid=bookmark-STHA&xid=3300d78b","GALE|XFZBCX279088978","2021-10-06","[""The Sunday Times Historical Archive,""]","['rec5hnSzuyYB34qhu']","""It gave an example of Things Fall Apart by Chinua Achebe, a celebrated Nigerian author""","","","","[""censorship""]"," - ","","['recxGCderkNDxjbuR']","True","[Allen-Mills, Tony]()|Reporter;;;[Allen-Mills, Tony]()|Article Author","","[""Allen-Mills, Tony""]","2010",""
"recHaIXOqnGW4mT9l","'Saviour' Tshombe may help himself to power (1964-06-28)","apdp.news.000585","'Saviour' Tshombe may help himself to power","News Report","1964-06-28","['recd5QaydfA6Ls4RM']","[""The Sunday Times""]","p. 5","https://link-gale-com.libproxy.unl.edu/apps/doc/FP1801517624/STHA?u=linc74325&sid=bookmark-STHA&xid=9a730f21","GALE|FP1801517624","2022-04-08","[""The Sunday Times Historical Archive,""]","['rec5hnSzuyYB34qhu']","""Followers of the late Patrice Lumumba have started another rising in Stanleyville to the north.""","","","","[""politics"", ""postcolonialism""]","","© Times Newspapers Limited.","['recFuYedVsqqYNBej', 'reclmgDFmK2gwASWT']","True","[Lumumba, Patrice Hemery](apdp.person.000085)|Mentioned Poet;;;[West,  Richard]()|Reporter","[""Lumumba, Patrice Hemery""]","","1960",""
"recHyFgqrGOIplqAg","""A New Poet"": Miss Sitwell's Review (1936-11-22)","apdp.news.000397","""A New Poet"": Miss Sitwell's Review","Editorial Letter","1936-11-22","['recd5QaydfA6Ls4RM']","[""The Sunday Times""]","p. 9","https://link-gale-com.libproxy.unl.edu/apps/doc/FP1800302619/STHA?u=linc74325&sid=bookmark-STHA&xid=1a19809c","GALE|FP1800302619","2021-12-24","[""The Sunday Times Historical Archive,""]","['rec5hnSzuyYB34qhu']","""To the Editor of The Sunday Times.""","","","","[""letter"", ""poetry""]","","© Times Newspapers Limited.","['rechK95NyoPFdfewZ', 'recKor5TZNLINi1eU', 'recdD9atGIYqmuqsZ']","True","[Campbell, Roy](apdp.person.000514)|Mentioned Poet;;;[Kenneth Hare, W. P]()|Author;;;[Fleming, Edward Vandermere]()|Author","[""Campbell, Roy""]","","1930",""
"reclg9nSJcTo3lkaa","""Doctor Jim"" (1922-10-22)","apdp.news.000685","""Doctor Jim""","Book Review","1922-10-22","['recd5QaydfA6Ls4RM']","[""The Sunday Times""]","p. 6 ","https://link-gale-com.libproxy.unl.edu/apps/doc/FP1800922040/GDCS?u=linc74325&sid=bookmark-GDCS&xid=d3628569","GALE|FP1800922040","2022-05-09","[""The Sunday Times Historical Archive,""]","['rec5hnSzuyYB34qhu']","""The fact that his mother was a Pringle might have suggested to Mr. Colvin that Scott's friend, Thomas Pringle, was on of the earliest laureates of South Africa.""","","","","[""poetry""]","","© Times Newspapers Limited.","['recXaR9xfiMUmUeAU', 'rechR9vVbnPvfj7JM']","True","[Pringle, Thomas](apdp.person.000168)|Mentioned Poet;;;[R, J M]()|Reporter","[""Pringle, Thomas""]","","1920",""
"recU3VhBPjvOGeKpw","""The Brooding Earth"" (1930-02-02)","apdp.news.000518","""The Brooding Earth""","Editorial Letter","1930-02-02","['recd5QaydfA6Ls4RM']","[""The Sunday Times""]","p. 12","https://link-gale-com.libproxy.unl.edu/apps/doc/FP1800978249/STHA?u=linc74325&sid=bookmark-STHA&xid=dcbbd318","GALE|FP1800978249","2022-03-14","[""The Sunday Times Historical Archive,""]","['rec5hnSzuyYB34qhu']","""Sir,--In answer to Mr. D. G. Stephens, the author of ""The Brooding Earth"" was Mr. Shearly Arthur Cripps, or Wreningham, Mashonaland, who seems to have worked there under the late Bishop Powell.""","","","","[""letter""]","","© Times Newspapers Limited.","","True","","","","1930",""
"recDb9mgV2K7ea8CV","17 Die in Clash over Gizenga (1962-01-14)","apdp.news.000577","17 Die in Clash over Gizenga","News Report","1962-01-14","","","p. 1","https://link-gale-com.libproxy.unl.edu/apps/doc/FP1801827607/STHA?u=linc74325&sid=bookmark-STHA&xid=0a6936ec","GALE|FP1801827607","2022-04-08","[""The Sunday Times Historical Archive,""]","['rec5hnSzuyYB34qhu']","""Mr. Genzenga self-appointed political heir of the late Patrice Lumumba has refused to leave his ""stronghold"" of Stanleyville in the Orientale province, and play his part in the Central Government."" ","","","","[""politics"", ""colonialism"", ""decolonization"", ""postcolonialism""]","","© Times Newspapers Limited.","['rec0WaxjDlt4VwZPW']","True","[Lumumba, Patrice Hemery](apdp.person.000085)|Mentioned Poet","[""Lumumba, Patrice Hemery""]","","1960",""
"recL5Ov5slzthgeaf","18-Month Sentence on Brutus (1964-01-10)","apdp.news.000205","18-Month Sentence on Brutus","News Report","1964-01-10","['rec3qJ9cAS12R9eSf']","[""The Times""]","p. 9"," https://link.gale.com/apps/doc/CS151873066/GDCS?u=linc74325&sid=GDCS&xid=5daec6da","GALE|CS151873066","2019-12-17","[""The Times Digital Archive""]","['recIReHwRKnt2RoPo']","[Full Text]: ""Denis Vincent Brutus, president of the South African Non-Racial Olympic Committee, was sentenced to 18 months imprisonment today by a Johannesburg magistrate on four charges of contravening a banning order and one of escaping from custody. Brutus was the centre of a diplomatic incident last September after he was shot down in a busy Johannesburg street by a police warrant officer as he made a dash for freedom. Brutus was banned and confined to the magisterial area of Johannesburg last year after his return from Europe where he had made representations about discrimination in Olympic teams. He broke his ban and went to Swaziland from where he intended to return to Europe to approach Olympic headquarters in Switzerland, but after crossing the border into Mozambique he was arrested by Portuguese secret police and returned to South Africa. Brutus said at the time and repeated in court today, while pleading in mitigation of sentence, that he had had a valid Rhodesian Federation passport. During the diplomatic row at that time Pretoria submitted that Brutus was a South African citizen. The magistrate ruled that Brutus's contention that his escape bid was made to draw attention to his situation was not altogether valid, but the court would take into account that he had been wounded, which was a partial penalty for his offence. ","","['recw9dVq0ifKimrP0']","[Arrest and Imprisonment of Dennis Brutus](apdp.event.000100)","[""apartheid"", ""prison"", ""imprisonment"", ""detainment"", ""passport"", ""shooting"", ""penalty""]"," - ","© Times Newspapers Limited.","['recT1BD18GkflB9dZ']","True","[Brutus, Dennis Vincent](apdp.person.000779)|Poet","[""Brutus, Dennis Vincent""]","","1960",""
"recNbvnU0iFgYJpNI","19 nations join in Olympics protest (1976-07-20)","apdp.news.000208","19 nations join in Olympics protest","News Report","1976-07-20","['rec3qJ9cAS12R9eSf']","[""The Times""]","p. 1","https://link.gale.com/apps/doc/CS17792756/GDCS?u=linc74325&sid=GDCS&xid=ca0b174d","GALE|CS17792756","2019-12-17","[""The Times Digital Archive""]","['recIReHwRKnt2RoPo']","[Full Text]: ""The number of countries which have withdrawn from the Olympic Games in protest at the New Zealand rugby tour of South Africa increased to 19 yesterday with the news that the team of Mali has been instructed to return home by their Minister of Sport. Thirteen countries have formally notified the International Committee of their withdrawal. They are Congo, Chad, Ethiopia, Ghana, Kenya, Nigeria, Zambia, Cameroon, Guyana, Niger, Togo, Uganda and Swaziland. Algeria, Iraq, Libya, and Upper Volta have verbally informed the IOC that they will not be taking part, and news was received yesterday from Cairo that Egypt is also pulling out. Before the news was received of Mali's marching orders, 303 competitors and 60 officials were listed as leaving the Olympics. This still left 6,934 competitors and 2,825 officials from 100 countries taking part with, in most cases, undiminished enthusiasm. Two of the chief boycott organizers have already left the battlefield. Abraham Ordia, of the Supreme Council for Sport in Africa, has flown home to Nigeria, and Denis Brutus, president of the South African Non-racial Olympic Committee, has left the Queen Elizabeth hotel, where his bemused elderly victims in the IOC are also housed, to return to his university in Chicago. Both men have obviously decided to leave the possibility of further withdrawals in the hands of the remaining uncommitted Caribbean, French-speaking African and Arab governments.""","","['rec5BR1dbaQ9phwSM']","[Dennis Brutus protests the Olympics (SANROC), 1977, London](apdp.event.000091)","[""apartheid"", ""athlete"", ""protest"", ""demonstration"", ""boycott"", ""sport"", ""Olympics""]"," - ","© Times Newspapers Limited.","['recmCAgBZBzaKQPUJ', 'rechMoWnecfIgTX5G', 'recq2Jf0PGMUWZqa5']","True","[Brutus, Dennis Vincent](apdp.person.000779)|Poet;;;[Allen, Neil]()|Reporter;;;[Ordia, Abraham]()|Politician","[""Brutus, Dennis Vincent""]","","1970",""
"recrXFoBFfsPdawn1","100 Books to Love (2013-10-06)","apdp.news.000355","100 Books to Love","Critical Article","2013-10-06","['recd5QaydfA6Ls4RM']","[""The Sunday Times""]"," - ","https://link-gale-com.libproxy.unl.edu/apps/doc/AHIOOX048924915/STHA?u=linc74325&sid=bookmark-STHA&xid=c4e80182","GALE|AHIOOX048924915","2021-10-06","[""The Sunday Times Historical Archive,""]","['rec5hnSzuyYB34qhu']","""Things Fall Apart Chinua Achebe)","[Things Fall Apart (1958)](apdp.work.000170)","","","[""list""]"," - ","© Times Newspapers Limited.","['recwSvUnWPU5DncJ8']","True","[Achebe, Chinua 'Albert Chinualumogu'](apdp.person.000265)|Writer","[""Achebe, Chinua 'Albert Chinualumogu'""]","","2010",""
"rec4XxpxQpmXNIUjk","1000 Makers of Sport (1996-06-02)","apdp.news.000467","1000 Makers of Sport","News Report","1996-06-02","['recd5QaydfA6Ls4RM']","[""The Sunday Times""]","","https://link-gale-com.libproxy.unl.edu/apps/doc/FP1803727634/STHA?u=linc74325&sid=bookmark-STHA&xid=26647a57","GALE|FP1803727634","2022-01-24","[""The Sunday Times Historical Archive,""]","['rec5hnSzuyYB34qhu']","""Dennis Brutus, Anti-apartheid campaigner, South Africa, b. 1924.""","","","","[""sport"", ""apartheid"", ""poetry""]","","© Times Newspapers Limited.","['recGUHi2V1E3iq6E4']","True","[Brutus, Dennis Vincent](apdp.person.000779)|Mentioned Poet","[""Brutus, Dennis Vincent""]","","1990",""
"recoYwqmdBt9mVVAP","1945 and all that (1971-10-31)","apdp.news.000624","1945 and all that","News Report","1971-10-31","['recd5QaydfA6Ls4RM']","[""The Sunday Times""]","p. 61[S]","https://link-gale-com.libproxy.unl.edu/apps/doc/FP1802189829/GDCS?u=linc74325&sid=bookmark-GDCS&xid=ca89cbee","GALE|FP1802189829","2022-04-11","[""The Sunday Times Historical Archive,""]","['rec5hnSzuyYB34qhu']","""A Katanga secesion movement developed, and the U.N became caught up in the intricate national, tribal, personal rivalries exemplified by the Congolese President Joseph Kasavubu, the Prime Minister, Patrice Lumumba, and the Katanga leader Moise Tshombe.""","","","","[""colonialism"", ""postcolonialism"", ""secession""]","","© Times Newspapers Limited.","['recABS3xessmv9jw8', 'recPMZCtphZmI8buH']","True","[Lumumba, Patrice Hemery](apdp.person.000085)|Mentioned Poet;;;[Tshombe, Moïse Kapenda]()|Politician","[""Lumumba, Patrice Hemery""]","","1970",""
"reck6h0cr8y2hg5eI","1995: All the News and Views (1995-12-17)","apdp.news.000841","1995: All the News and Views","Feature","1995-12-17","['recd5QaydfA6Ls4RM']","[""The Sunday Times""]","p. 9[S1]","https://link-gale-com.libproxy.unl.edu/apps/doc/FP1803135256/GDCS?u=linc74325&sid=bookmark-GDCS&xid=084bd436","GALE|FP1803135256","2022-05-30","[""The Sunday Times Historical Archive,""]","['rec5hnSzuyYB34qhu']","""...such as the hanging of Ken Saro-Wiwa""","","","","[""execution""]","","© Times Newspapers Limited.","['recEGDMFYFn62G9cp']","True","[Saro-Wiwa, Ken](apdp.person.000816)|Writer","[""Saro-Wiwa, Ken""]","","1990",""
"rec6AVNcvDZFimqgA","A bevy of writers all under the influence (2002-04-22)","apdp.news.000721","A bevy of writers all under the influence","Book Review","2002-04-22","['recd5QaydfA6Ls4RM']","[""The Sunday Times""]","p. 39[S7]","https://link-gale-com.libproxy.unl.edu/apps/doc/FP1801774310/GDCS?u=linc74325&sid=bookmark-GDCS&xid=3699a0f6","GALE|FP1801774310","2022-05-18","[""The Sunday Times Historical Archive,""]","['rec5hnSzuyYB34qhu']","""He is immensely knowledgeable about the mainstream writings about Shakespeare from Ben Johnson - Ben Okri--the latter contributed about a black person's complex reactions to Otello."" ","","","","[""anthology""]","","© Times Newspapers Limited.","['recQx9fcF14CA5jkG', 'rec5UvnTtcUu5nESR']","True","[Okri, Ben](apdp.person.000331)|Mentioned Poet;;;[Carpenter , Humphrey William Bouverie 'Humphrey Carpenter ']()|Reporter","[""Okri, Ben""]","","2000",""
"recZO9YRaunCDD56g","A blaze of light on Auden (1963-12-08)","apdp.news.000636","A blaze of light on Auden","Book Review","1963-12-08","['recd5QaydfA6Ls4RM']","[""The Sunday Times""]","p.37","https://link-gale-com.libproxy.unl.edu/apps/doc/FP1801979120/GDCS?u=linc74325&sid=bookmark-GDCS&xid=8546752e","GALE|FP1801979120","2022-04-12","[""The Sunday Times Historical Archive,""]","['rec5hnSzuyYB34qhu']","""But Lenin, thous shouldst be living at theis hour, was written mt Charles Madge.""","","","","[""poetry"", ""review""]","","© Times Newspapers Limited.","['recnzXqPyStnH85z6', 'recipYElVRueiAlfP', 'rec9s2D2rmSEdD45F']","True","[Lumumba, Patrice Hemery](apdp.person.000085)|Mentioned Poet;;;[Connolly, Cyril Vernon 'Cyril Connolly']()|Critic;;;[Auden, Wystan Hugh 'W. H.']()|Mentioned Poet","[""Lumumba, Patrice Hemery""]","","1960",""
"recyqzkBXJvSClNFc","A Bolter and the Invincible Summer (1988-09-04)","apdp.news.000558","A Bolter and the Invincible Summer","Book Review","1988-09-04","['recd5QaydfA6Ls4RM']","[""The Sunday Times""]","p. 8[S5]","https://link-gale-com.libproxy.unl.edu/apps/doc/FP1802062950/STHA?u=linc74325&sid=bookmark-STHA&xid=550b37b0","GALE|FP1802062950","2022-04-05","[""The Sunday Times Historical Archive,""]","['rec5hnSzuyYB34qhu']","""He was the Afrikaan poet and playwright Uys Krige who wrote in English as well, had lived in France and Spain, spoke five languages, was familiar with their literature, and translated from three.""","","","","[""review"", ""apartheid"", ""poetry""]","","© Times Newspapers Limited.","['recL2OgOoFUTdE8an', 'reciX46OKhNxRsXqe', 'rec32HLFAFZzPdaxO']","True","[Krige, Uys](apdp.person.001004)|Mentioned Poet;;;[Gordimer, Nadine]()|Writer;;;[Clingman, Stephen]()|Editor","[""Krige, Uys""]","","1980",""
"recPiNogrpz632nkQ","A change of address (2002-01-25)","apdp.news.000250","A change of address","Book Review","2002-01-25","['rechlrrQ3ggxkp9tc']","[""The Times Literary Supplement""]","p. 25"," https://link.gale.com/apps/doc/EX1200507640/GDCS?u=linc74325&sid=GDCS&xid=eb82ab4f","GALE|EX1200507640","2020-01-23","[""The Times Literary Supplement Historical Archive,""]","['recPtoWyYeZuupAcO']","[Excerpt]: Robert Potts reviews Geoffrey Hill's Speech! Speech! ... ""One of the students whom Geoffrey Hill taught at Cambridge (1981-8) used to quote his tutor in letters to friends... Reading Geoffrey Hill can itself feel like receiving a reading list--one is frequently referred to texts and events with which one is unhappily unfamiliar--but the matter of Hill's 'difficulty' (his pun in The Triumph of Love, that he is 'charged with erudition', did little to allay criticism of his range of references) has surely been adequately dealt with, not least by the poet himself... The writers Chinua Achebe and Christopher Okigbo, variously alluded to, both worked for Nigerian radio before the Befran conflict, sinister and exemplary details of which are found throughout Speech! Speech! ...""","","","","[""radio"", ""Biafra"", ""secession"", ""war"", ""violence""]"," - ","","['recKVLP1l97Qc4IfI', 'recSrX6IWB12LAJUZ', 'rec2MWEylVxrlIlKX', 'recTfz3jyK8AgFPV5', 'rec282yi0gWcFF8Ox', 'reckeYLj8dL48LqdK', 'recnhrpoFdM8uNBMc', 'recapbd8zidBQS4m9', 'recTxNvQ5NckFaWpf', 'rec0rXD0mD7pmZ6DR', 'recIlzkzKRY2lZOuB']","True","[Achebe, Chinua 'Albert Chinualumogu'](apdp.person.000265)|Poet;;;[Okigbo, Christopher](apdp.person.001150)|Poet;;;[Hill, Geoffrey]()|Mentioned Poet;;;[Yeats, William Butler 'W. B.']()|Mentioned Poet;;;[Pound, Ezra]()|Mentioned Poet;;;[Eliot, Thomas Stearns 'T. S.']()|Mentioned Poet;;;[Lewis, C. S.]()|Writer;;;[Grass, Günter Wilhelm]()|Writer;;;[Bonhoeffer, Dietrich]()|Writer;;;[Nagy, Imre]()|Politician;;;[Potts, Robert]()|Critic;;;[Potts, Robert]()|Article Author","[""Achebe, Chinua 'Albert Chinualumogu'"", ""Okigbo, Christopher""]","[""Potts, Robert""]","2000",""
"recx23187A5uaWUpm","A farewell to Provence (1971-01-10)","apdp.news.000421","A farewell to Provence","Critical Article","1971-01-10","['recd5QaydfA6Ls4RM']","[""The Sunday Times""]","p. 11","https://link-gale-com.libproxy.unl.edu/apps/doc/FP1801688228/STHA?u=linc74325&sid=bookmark-STHA&xid=1046d7cd","GALE|FP1801688228","2022-01-11","[""The Sunday Times Historical Archive,""]","['rec5hnSzuyYB34qhu']","""A man has only one virginity to lose and there his heart will ever be,"" wrote Hemingway to Berenson, adding that he was ""an old Veneto boy.""","[Light on a Dark Horse (1952)](apdp.work.000070)","","","[""poetry"", ""poem"", ""travel""]","","© Times Newspapers Limited.","['recx8G9o21I9fW5QR', 'rec6Ci3kQcPBPChsJ', 'recwPFbuJH2OvJJtZ', 'reclkckZ1ShWnxgYZ']","True","[Campbell, Roy](apdp.person.000514)|Mentioned Poet;;;[Hemingway, Ernest]()|Mentioned Poet;;;[Connolly, Cyril Vernon 'Cyril Connolly']()|Critic;;;[Connolly, Cyril Vernon 'Cyril Connolly']()|Article Author;;;[Campbell, Roy](apdp.person.000514)|Mentioned Poet","[""Campbell, Roy"", ""Campbell, Roy""]","[""Connolly, Cyril Vernon 'Cyril Connolly'""]","1970",""
"recZJ6HXqU6QEM0JP","A fine and private place? (1980-03-09)","apdp.news.000638","A fine and private place?","Book Review","1980-03-09","['recd5QaydfA6Ls4RM']","[""The Sunday Times""]","p. 43","https://link-gale-com.libproxy.unl.edu/apps/doc/FP1802212833/GDCS?u=linc74325&sid=bookmark-GDCS&xid=a7561671","GALE|FP1802212833","2022-04-12","[""The Sunday Times Historical Archive,""]","['rec5hnSzuyYB34qhu']","""So it was natural, however unwise, of Charles Madge to let the word ""boy"" be the climax of his tribute.""","","","","[""review"", ""poetry"", ""biography""]","","© Times Newspapers Limited.","['rect7A8vYoPRznxmF', 'recVCaUwwmEFMufaI', 'recX9AYBidKFyH0QB']","True","[Auden, Wystan Hugh 'W. H.']()|Mentioned Poet;;;[Madge, Charles Henry](apdp.person.000235)|Mentioned Poet;;;[Ricks,  Christopher]()|Critic","[""Madge, Charles Henry""]","","1980",""
"receAwJJeZIpNbLPl","A Fresh Caress of Familiar Faces (2014-02-04)","apdp.news.000754","A Fresh Caress of Familiar Faces","Feature","2014-02-04","['recd5QaydfA6Ls4RM']","[""The Sunday Times""]","p. 3","https://link-gale-com.libproxy.unl.edu/apps/doc/LHTUDP565687372/GDCS?u=linc74325&sid=bookmark-GDCS&xid=1e5d7715","GALE|LHTUDP565687372","2022-05-21","[""The Sunday Times Historical Archive,""]","['rec5hnSzuyYB34qhu']","To know your work
Is not to guess your face
To see your face is not
To imagine your work
Your work is a world
Your face is a mask
Behind which the unknown
Master Smiles'
Ben Okri, author and poet","","","","[""poetry""]","","© Times Newspapers Limited.","['recj5C2glsUSvzE4L', 'recoCOujHShv5llNj', 'recwoHhHY4k4w2acz', 'recw6aQqIrrSDpaZe', 'rec4KU6A4TXDXZ1Qn']","True","[Byatt, A. S.  'Antonia Susan Duffy Drabble']()|Poet;;;[Wilde, Oscar]()|Poet;;;[Cromwell, Thomas]()|Poet;;;[Okri, Ben](apdp.person.000331)|Poet;;;[Shakespeare, William]()|Poet","[""Okri, Ben""]","","2010",""
"recchpyRVXsLJEFm7","A garbled message (1990-05-18)","apdp.news.000021","A garbled message","Book Review","1990-05-18","['rechlrrQ3ggxkp9tc']","[""The Times Literary Supplement""]","p. 533","http://link.galegroup.com/apps/doc/EX1200460359/GDCS?u=linc74325&sid=GDCS&xid=7bea388b","GALE|EX1200460359","2019-07-01","[""The Times Literary Supplement Historical Archive,""]","['recPtoWyYeZuupAcO']","Watson compares the two anthologies of African poetry, one compiled by Stephen Gray and the other Jane Watts. Of Penguin's anthology, he writes, ""No work to date so completely misrepresents the full spectrum of poetry from this part of the world, and seems so perversely designed to mislead readers who do not already have extensive independent knowledge of local political and cultural history... Gray claims that all nations of southern African belong to a single 'literary system' whose importance overrides any division of the area into separate nation-states."" Of Watts, Watson has a more positive opinion, in that Watts instead makes the ""essential point"" that the work of black writers in South Africa is ""very different from that of African writers elsewhere."" He then writes that, ""having presented these differences, [Jane Watts] is able to explain with admirable lucidity why black writing in this country has progressively assumed an identity all its own, and most particularly why it no longer conforms to Western aesthetic standards.""","[The Penguin Book of Southern African Verse (1989)](apdp.work.000230)","","","[""review"", ""criticism"", ""indigenous"", ""identity"", ""aesthetic""]"," - ","","['recY1LosCMWsaMfT9', 'rec0hWBNJrSxkn0XU', 'recI14jF9KCNgsPTL', 'recnQXjZf9AtZ11ob', 'recmZ0Z89yjJubuVd', 'recOK9nqGIHL6B1qJ', 'recI49kpLGmVGI59r', 'receEE6aIdNWuwzCH', 'rec2rxIhLNXYF1lpR']","True","[Breytenbach, Breyten](apdp.person.001295)|Poet;;;[Campbell, Roy](apdp.person.000514)|Poet;;;[Livingstone, Douglas]()|Poet;;;[Cope, Robert Knox 'Jack'](apdp.person.000632)|Poet;;;[Horn, Peter Rudolf Gisela](apdp.person.001139)|Poet;;;[Plaatje, Solomon Tshekisho](apdp.person.000246)|Poet;;;[Mtshali, Oswald Mbuyiseni](apdp.person.001092)|Poet;;;[Watson, Stephen](apdp.person.001227)|Critic;;;[Watson, Stephen](apdp.person.001227)|Article Author;;;[Schreiner, Olive]()|Writer","[""Breytenbach, Breyten"", ""Campbell, Roy"", ""Cope, Robert Knox 'Jack'"", ""Horn, Peter Rudolf Gisela"", ""Plaatje, Solomon Tshekisho"", ""Mtshali, Oswald Mbuyiseni"", ""Watson, Stephen""]","[""Watson, Stephen""]","1990",""
"rec6y5irxVicI2bcT","A global perspective at Tate Modern? No, just an international disaster, says Waldemar Januszczak (2001-02-04)","apdp.news.000334","A global perspective at Tate Modern? No, just an international disaster, says Waldemar Januszczak","Critical Article","2001-02-04","['recd5QaydfA6Ls4RM']","[""The Sunday Times""]","p. 14[S8]","https://link-gale-com.libproxy.unl.edu/apps/doc/FP1802992649/STHA?u=linc74325&sid=bookmark-STHA&xid=8aef7299","GALE|FP1802992649","2021-10-02","[""The Sunday Times Historical Archive,""]","['rec5hnSzuyYB34qhu']","""Oh dear. The first exhibition at the Tate modern is a disaster.""","","","","[""museum"", ""art""]"," - ","© Times Newspapers Limited.","['recThYLk1K2okAmm2', 'recxqZWt3TlAekDuZ', 'recLjK5kp1uqjmF5E']","True","[Achebe, Chinua 'Albert Chinualumogu'](apdp.person.000265)|Writer;;;[Soyinka , Wole 'Akinwande Oluwole Babatunde'](apdp.person.000930)|Mentioned Poet;;;[Januszczak, Waldemar]()|Editor;;;[Januszczak, Waldemar]()|Article Author","[""Achebe, Chinua 'Albert Chinualumogu'"", ""Soyinka , Wole 'Akinwande Oluwole Babatunde'""]","[""Januszczak, Waldemar""]","2000",""
"recV9mEijmOscx8NV","A golden age of translators (1963-01-20)","apdp.news.000413","A golden age of translators","Critical Article","1963-01-20","['recd5QaydfA6Ls4RM']","[""The Sunday Times""]","p. 33","https://link-gale-com.libproxy.unl.edu/apps/doc/FP1802512155/STHA?u=linc74325&sid=bookmark-STHA&xid=cd82618d","GALE|FP1802512155","2022-01-03","[""Gale Primary Sources Database\n\nPrint:""]","['rec40evpnfEC8TWCx']","""Not since the renaissance has the art and craft of translation--especially from the classics of Greece and Rome--such a level of quality and quantity.""","","","","[""translation"", ""poetry""]","","© Times Newspapers Limited.","['recW6c0Vlsq66BA28', 'recUcoHCwwjtb0mCk']","True","[Steiner, George]()|Editor;;;[Campbell, Roy](apdp.person.000514)|Mentioned Poet","[""Campbell, Roy""]","","1960",""
