"airtableID","title","unique_id","Article title","Document type","Article Date (formatted)","[publication]","publisher","Source page no","Source link","Gale ID","Source access date","rights_holder","[archive]","Excerpt","works","[events]","subjects","Tags","Notes","Permissions","[news item roles]","Complete","person","contributor.name","creator.name","topics-decade","commentaries-link"
"","Main Channels Monday 9 June (2008-06-08)","apdp.news.000340","Main Channels Monday 9 June","Radio Schedule","2008-06-08","['recd5QaydfA6Ls4RM']","[""The Sunday Times""]","p. 57","https://link-gale-com.libproxy.unl.edu/apps/doc/IKUDTW457119895/STHA?u=linc74325&sid=bookmark-STHA&xid=8d68699c","GALE|IKUDTW457119895","2021-10-02","[""The Sunday Times Historical Archive,""]","['rec5hnSzuyYB34qhu']","""Book at Bedtime: Things Fall Apart, by Chinua Achebe""","","","","[""radio"", ""announcement""]"," - ","© Times Newspapers Limited.","['recelAifxB30m51Yt']","True","[Achebe, Chinua 'Albert Chinualumogu'](apdp.person.000265)|Mentioned Poet","[""Achebe, Chinua 'Albert Chinualumogu'""]","","2000",""
"","Main Channels Wednesday 25 March (2009-03-22)","apdp.news.000343","Main Channels Wednesday 25 March","Radio Schedule","2009-03-22","['recd5QaydfA6Ls4RM']","[""The Sunday Times""]","p. 64","https://link-gale-com.libproxy.unl.edu/apps/doc/XXPCXG433884641/STHA?u=linc74325&sid=bookmark-STHA&xid=f6f6566b","GALE|XXPCXG433884641","2021-10-06","[""The Sunday Times Historical Archive,""]","['rec5hnSzuyYB34qhu']","""9:06 Chinua Achebe - A Hero Returns""","","","","[""radio"", ""announcement""]"," - ","© Times Newspapers Limited.","['recv6A5zJrpK1NUvx']","True","[Achebe, Chinua 'Albert Chinualumogu'](apdp.person.000265)|Mentioned Poet","[""Achebe, Chinua 'Albert Chinualumogu'""]","","2000",""
"","Main Channels Wednesday14 May (2008-05-11)","apdp.news.000550","Main Channels Wednesday14 May","Radio Schedule","2008-05-11","['recd5QaydfA6Ls4RM']","[""The Sunday Times""]","p. 72[S10]","https://link-gale-com.libproxy.unl.edu/apps/doc/WIYTQP134315733/GDCS?u=linc74325&sid=bookmark-GDCS&xid=db07a0f5","GALE|WIYTQP134315733","2022-04-05","[""The Sunday Times Historical Archive,""]","['rec5hnSzuyYB34qhu']","""The Essay. Christopher Hope links Sputnik with rock'n'roll (R)""","","","","[""Nonfiction"", ""essay"", ""poetry""]","","© Times Newspapers Limited.","['recgekHPnybbzIFCM']","True","[Hope, Christopher](apdp.person.000346)|Poet","[""Hope, Christopher""]","","2000",""
"","Major column inches ahead (1992-01-05)","apdp.news.000731","Major column inches ahead","News Report","1992-01-05","['recd5QaydfA6Ls4RM']","[""The Sunday Times""]","p. 4","https://link-gale-com.libproxy.unl.edu/apps/doc/FP1802421567/GDCS?u=linc74325&sid=bookmark-GDCS&xid=911b9c20","GALE|FP1802421567","2022-05-18","[""The Sunday Times Historical Archive,""]","['rec5hnSzuyYB34qhu']","""Many people to watch in 1992 include the most upwardly mobile names of the last year's list. Ben Okri, Booker prize winner had only four mentions in 1990 but 92 in 1991, an increase of 2,200%.""","","","","[""prize""]","","© Times Newspapers Limited.","['recOxnilnZFWbrcqi', 'recJowaV8ZUkVvcUd']","True","[Lees, Caroline]()|Reporter;;;[Okri, Ben](apdp.person.000331)|Writer","[""Okri, Ben""]","","1990",""
"","Man—Instinctive Killer? (1961-10-15)","apdp.news.000653","Man—Instinctive Killer?","Book Review","1961-10-15","['recd5QaydfA6Ls4RM']","[""The Sunday Times""]","p. 11","https://link-gale-com.libproxy.unl.edu/apps/doc/FP1800679166/STHA?u=linc74325&sid=bookmark-STHA&xid=59a4b49c","GALE|FP1800679166","2022-04-13","[""The Sunday Times Historical Archive,""]","['rec5hnSzuyYB34qhu']","""Towering over them all is an unknown figure, one Eugene Marais,"" the purest genius that the natural sciences have seen in this century.""","","","","[""nature""]","","© Times Newspapers Limited.","['recHe8quz4Qfr0LLh', 'recePlvAiHP2fTvG6']","True","[Marais, Eugène Nielen](apdp.person.000100)|Mentioned Poet;;;[Ashton, E. H.]()|Critic","[""Marais, Eug\u00e8ne Nielen""]","","1960",""
"","Mandela touts 'Mr Fluff-it' as heir (1996-06-07)","apdp.news.000825","Mandela touts 'Mr Fluff-it' as heir","News Report","1996-06-07","['recd5QaydfA6Ls4RM']","[""The Sunday Times""]","p. 18","https://link-gale-com.libproxy.unl.edu/apps/doc/FP1802269568/GDCS?u=linc74325&sid=bookmark-GDCS&xid=37284ba5","GALE|FP1802269568","2022-05-29","[""The Sunday Times Historical Archive,""]","['rec5hnSzuyYB34qhu']","""He is also blamed for the architect of South Africa softly-softly approach to Nigeria's military rulers, which some say caused the regime to hang Ken Saro-Wiwa the Ogoni activist and leader and eight of his colleagues last year. ","","","","[""military"", ""dictator"", ""diplomacy"", ""execution"", ""politics""]","","© Times Newspapers Limited.","['receYqYtsML7iBQvT', 'recWsDuQalF068XrF', 'recJ2fyc8FVnws5Rs', 'recNmtG80Of7u77N1']","True","[Saro-Wiwa, Ken](apdp.person.000816)|Writer;;;[Mandela, Nelson]()|Politician;;;[Mbeki , Thabo Mvuyelwa 'Thabo Mbeki ']()|Politician;;;[Block, Robert]()|Reporter","[""Saro-Wiwa, Ken""]","","1990",""
"","Marcel Proust slept here (1965-06-20)","apdp.news.000414","Marcel Proust slept here","Book Review","1965-06-20","['recd5QaydfA6Ls4RM']","[""The Sunday Times""]","p. 41","https://link-gale-com.libproxy.unl.edu/apps/doc/FP1800758293/STHA?u=linc74325&sid=bookmark-STHA&xid=ff910481","GALE|FP1800758293","2022-01-03","[""Gale Primary Sources Database\n\nPrint:""]","['rec40evpnfEC8TWCx']","""Eight hundred and fifty pages without a dull moment and unlike any novel of the same length, without requiring us to apologise for a sag in the middle."" ","[Guide Littéraire De La France (1964)](apdp.work.000114)","","","[""poetry""]","","© Times Newspapers Limited.","['recwPFbuJH2OvJJtZ', 'recz7o1xM9HQEGReH']","True","[Connolly, Cyril Vernon 'Cyril Connolly']()|Critic;;;[Connolly, Cyril Vernon 'Cyril Connolly']()|Article Author;;;[Campbell, Roy](apdp.person.000514)|Mentioned Poet","[""Campbell, Roy""]","[""Connolly, Cyril Vernon 'Cyril Connolly'""]","1960",""
"","Meet the Authors at . . . (1999-07-02)","apdp.news.000758","Meet the Authors at . . .","Critical Article","1999-07-02","['recd5QaydfA6Ls4RM']","[""The Sunday Times""]","p. 5","https://link-gale-com.libproxy.unl.edu/apps/doc/EE1860559271/GDCS?u=linc74325&sid=bookmark-GDCS&xid=1ff7c183","GALE|EE1860559271","2022-05-21","[""The Sunday Times Historical Archive,""]","['rec5hnSzuyYB34qhu']","""And Ben Okri begs for a more gentle creative world.""","","","","[""report""]","","© Times Newspapers Limited.","['recK10GKwi7cYcpKa', 'recnEJjyTJtmPvh9m']","True","[Okri, Ben](apdp.person.000331)|Poet;;;[Hennessy, Val]()|Reporter","[""Okri, Ben""]","","1990",""
"","Meeting with Enrique Lihn (2009-02-03)","apdp.news.000792","Meeting with Enrique Lihn","Feature","2009-02-03","['recd5QaydfA6Ls4RM']","[""The Sunday Times""]","p. 62-63","https://link-gale-com.libproxy.unl.edu/apps/doc/OPQEFB792623201/GDCS?u=linc74325&sid=bookmark-GDCS&xid=8f2c34da","GALE|OPQEFB792623201","2022-05-26","[""The Sunday Times Historical Archive,""]","['rec5hnSzuyYB34qhu']","""The Sunday Times Oxford Literary Festival.""","","","","[""festival""]","","© Times Newspapers Limited.","['recDOSyO1G1SHrJfJ']","True","[Okri, Ben](apdp.person.000331)|Writer","[""Okri, Ben""]","","2000",""
"","Miracle at the margin (2000-11-24)","apdp.news.000288","Miracle at the margin","Book Review","2000-11-24","['rechlrrQ3ggxkp9tc']","[""The Times Literary Supplement""]","26","https://link.gale.com/apps/doc/EX1200540309/GDCS?u=linc74325&sid=GDCS&xid=9cf10ac2","GALE|EX1200540309","2020-07-27","[""The Times Literary Supplement Historical Archive,""]","['recPtoWyYeZuupAcO']","A book review for Stephen Gray's ""The Picador Book of African Stories."" Excerpt: ""In his introduction, Stephen Gray outlines his ambitions for his Picador Book of African Stories. The collection is to include a fair proportion of works originally written in languages other than English. It is to include stories from the islands off the eastern coast of Africa, a region previously neglected in African anthologies; and it is to admit 'irregular' writers who do not easily fall into the reductive classifications sometimes favoured by editors... Ama Ata Aidoo (from Ghana) and Fatmata Conteth (from Ethiopia) are among half-a-dozen writers who treat the lives of women with similarly captivating incisiveness..."" ","[The Picador Book of African Stories (2001)](apdp.work.000113)","","","[""anthology"", ""feminism"", ""women""]"," - ","","['recw44liVd80hTXQ9', 'recuiovWckSCsAsUS', 'recODlY4dRdWEeL01', 'recxw5qTiBCc3lfxt', 'rec4ywimWToBE5vBq', 'recG0tzTbC5Zd1Ecp', 'recVgWQ5L7JHjrezU', 'reclVDpAmR4PTyYDj', 'recCZuA9hvWBtWGf0', 'rec8tjewXTZ3Cj2OD', 'reccxH1z9XD5obxsm', 'recb9gksdRxgxk71n', 'recZfGJpmkMEDf8pk', 'recguVYVPerfxgcvt', 'recmy7gknvIfWDbOW', 'recMr0sAQCLUgIM7x', 'rec8pwxwraxcXVVnD', 'rec9fqperP1nktH3J', 'rec2yzA45sZS5yEpO', 'rec2gq9In53Xqt3CR', 'recTMpUQKABxyAcuN']","True","[Gray, Stephen]()|Editor;;;[Aidoo, Ama Ata 'Christina'](apdp.person.000708)|Poet;;;[Drury, Annmarie]()|Critic;;;[Drury, Annmarie]()|Article Author;;;[Honwana, Luis Bernardo]()|Writer;;;[Momplé, Lília]()|Writer;;;[Couto, António Emílio Leite 'Mia']()|Writer;;;[de Sousa, Teixeira]()|Writer;;;[Agualusa, José Eduardo](apdp.person.000226)|Writer;;;[Zeleza, Paul Tiyambe]()|Writer;;;[Vladislavić, Ivan]()|Writer;;;[Vera, Yvonne]()|Writer;;;[Conteth, Fatmata]()|Writer;;;[Soueif, Ahdaf]()|Writer;;;[Farah, Nuruddin]()|Writer;;;[Vassanji, Moyez G. 'M. G.']()|Writer;;;[Ugbabe, Kanchana]()|Writer;;;[Bebey, Francis]()|Writer;;;[Akalay, Lofti]()|Writer;;;[Mahfouz, Naguib]()|Writer;;;[wa Thiong'o, Ngugi 'James']()|Writer;;;[Okri, Ben](apdp.person.000331)|Poet","[""Aidoo, Ama Ata 'Christina'"", ""Agualusa, Jos\u00e9 Eduardo"", ""Okri, Ben""]","[""Drury, Annmarie""]","2000",""
"","Modern African Writers (1972-02-11)","apdp.news.000134","Modern African Writers","Advertisement","1972-02-11","['rechlrrQ3ggxkp9tc']","[""The Times Literary Supplement""]","p. 151","http://link.galegroup.com/apps/doc/EX1200378907/GDCS?u=linc74325&sid=GDCS&xid=01137e3f","GALE|EX1200378907","2019-06-29","[""The Times Literary Supplement Historical Archive,""]","['recPtoWyYeZuupAcO']","Modern African Writers: General editor, Gerald Moore. An important new series presenting critical studies of the works of Africa's leading novelists, poets, and dramatists. Wole Soyinka: Gerlad Moore. An account of the work of this remarkable Nigerian writer, best known as a major dramatist but also widely praised as a poet, novelist, and commentator.","","","","[""advertisement"", ""announcement"", ""critic"", ""review"", ""drama"", ""theater"", ""play""]"," - ","","['recp9b54zZVCQIVD1', 'recHgSMbBI7CC39Xt', 'rech2nVdcbii7kBU5', 'recQN8fa0t7ht6tu6']","True","[Soyinka, Wole](apdp.person.001220)|Poet;;;[Okigbo, Christopher](apdp.person.001150)|Mentioned Poet;;;[Moore, Gerald]()|Critic;;;[Moore, Gerald]()|Article Author;;;[Abrahams, Peter]()|Writer","[""Soyinka, Wole"", ""Okigbo, Christopher""]","[""Moore, Gerald""]","1970","[Wole Soyinka in The Times Advertisements and Announcements between 1965 and 1983](apdp.commentary.000003)"
"","Monday (1990-10-28)","apdp.news.000319","Monday","Radio Schedule","1990-10-28","['recd5QaydfA6Ls4RM']","[""The Sunday Times""]","p. 25[S5]","https://link-gale-com.libproxy.unl.edu/apps/doc/FP1802810568/STHA?u=linc74325&sid=bookmark-STHA&xid=aaf4fbed","GALE|FP1802810568","2021-09-29","[""The Sunday Times Historical Archive,""]","['rec5hnSzuyYB34qhu']","""Radio: The Monday Play: Anthills of the Savannah.""","[Anthills of the Savannah  (1987)](apdp.work.000005)","","","[""list"", ""fiction"", ""radio""]"," - ","© Times Newspapers Limited.","['recMAiVJqs3hC2rnB']","True","[Achebe, Chinua 'Albert Chinualumogu'](apdp.person.000265)|Writer","[""Achebe, Chinua 'Albert Chinualumogu'""]","","1990",""
"","Monday 16 November (2015-11-15)","apdp.news.000358","Monday 16 November","Radio Schedule","2015-11-15","['recd5QaydfA6Ls4RM']","[""The Sunday Times""]","p. 48","https://link-gale-com.libproxy.unl.edu/apps/doc/OYDJUR032641738/STHA?u=linc74325&sid=bookmark-STHA&xid=1a9ca9d6","GALE|OYDJUR032641738","2021-10-06","[""The Times Digital Archive""]","['recIReHwRKnt2RoPo']","""1:30 Chinua Achebe's Lament""","","","","[""radio"", ""announcement""]"," - ","© Times Newspapers Limited.","['rec3FIZBw8UbaPdVW']","True","[Achebe, Chinua 'Albert Chinualumogu'](apdp.person.000265)|Writer","[""Achebe, Chinua 'Albert Chinualumogu'""]","","2010",""
"","Monday 19 March (2012-03-18)","apdp.news.000652","Monday 19 March","Radio Schedule","2012-03-18","['recd5QaydfA6Ls4RM']","[""The Sunday Times""]","p. 60","https://link-gale-com.libproxy.unl.edu/apps/doc/FKRVQT935340062/STHA?u=linc74325&sid=bookmark-STHA&xid=0f7f3bd3","GALE|FKRVQT935340062","2022-04-13","[""The Sunday Times Historical Archive,""]","['rec5hnSzuyYB34qhu']","""Radio 4.
FM 92.4-94.6 MHz, LW 198 kHz (1515m), MW 720 kHz
Today. 9.00 Start the Week. With Nadine Gordimer and Jack Mapanje.""","","","","[""radio"", ""poetry""]","","© Times Newspapers Limited.","['recakcFUqRnXIIlqW', 'reccholmQC3rSLIwO']","True","[Mapanje, Jack](apdp.person.000409)|Mentioned Poet;;;[Gordimer, Nadine]()|Writer","[""Mapanje, Jack""]","","2010",""
"","Monday 31 August (1992-08-30)","apdp.news.000669","Monday 31 August","","1992-08-30","['recd5QaydfA6Ls4RM']","[""The Sunday Times""]","p. 6[S7]","https://link-gale-com.libproxy.unl.edu/apps/doc/FP1803115470/GDCS?u=linc74325&sid=bookmark-GDCS&xid=6907960f","GALE|FP1803115470","2022-04-15","[""The Sunday Times Historical Archive,""]","['rec5hnSzuyYB34qhu']","""10.00 FILM. Stars Georgina Ackerman, Roger Griffiths, Thomas Baptiste and Pitika Ntuli. African voyage of rediscovery about an irrepressible 12-year-old girl Ama, and her family's struggle to reconcile their ancestral history with life in 20th century London. (1990)""","","","","[""television"", ""poetry"", ""travel""]","","© Times Newspapers Limited.","['recHQPcakjn5LU1gT']","True","[Ntuli, Pitika](apdp.person.000290)|Mentioned Poet","[""Ntuli, Pitika""]","","1990",""
"","Money: the root of all books (1995-01-15)","apdp.news.000737","Money: the root of all books","News Report","1995-01-15","['recd5QaydfA6Ls4RM']","[""The Sunday Times""]","p. 6[S1]","https://link-gale-com.libproxy.unl.edu/apps/doc/FP1802912626/GDCS?u=linc74325&sid=bookmark-GDCS&xid=c7e0fcaa","GALE|FP1802912626","2022-05-19","[""The Sunday Times Historical Archive,""]","['rec5hnSzuyYB34qhu']","""Godwin who also represents Edna O'Brien and Ben Okri says ""undoubtedly"" conversations"" will come about that [the Amis deal].","","","","[""publication""]","","© Times Newspapers Limited.","['recjCuu5WR9eNfW5T', 'rec9xgpVsb3WPZWoM', 'recPgQ3soGEqMec1q']","True","[di Giovanni, Janine]()|Reporter;;;[Okri, Ben](apdp.person.000331)|Writer;;;[Amis, Martin]()|Writer","[""Okri, Ben""]","","1990",""
"","Monteal and Denver Chosen: North America scoops Olympics pool (1970-05-13)","apdp.news.000203","Monteal and Denver Chosen: North America scoops Olympics pool","News Report","1970-05-13","['rec3qJ9cAS12R9eSf']","[""The Times""]","p. 14","https://link.gale.com/apps/doc/CS235893421/GDCS?u=linc74325&sid=GDCS&xid=49748c25","GALE|CS235893421","2019-12-17","[""The Times Digital Archive""]","['recIReHwRKnt2RoPo']","[Excerpt]: ""North America scooped the pool when the voting took place here tonight for the 1976 Olympic Games. The summer sports are to be held in Montreal and the winter variety at Denver, Colorado. The choice of Montreal was greeted with volleys of applause, that for Denver with squeals of surprise... The case for South Africa's expulsion from the movement is to be put to the International Olympic Committee (I.O.C.) this week, probably on Friday, by Jean-Claude Ganga (Congo) and Abram Ordia (Nigeria), respectively secretary-general and president of the Supreme Council for Sport in Africa, a body embracing 19 countries. The South African National Olympic Committee, headed by Mr. Frank Braun, will have the right of reply, whereupon Mr. Ganga and Mr. Ordia will have a further 10 minutes to answer the case for the defense... The South African non-racial Open Committee for Olympic Sport (Sanroc) is here in force, but unavoidably without their guiding spirit, Mr. Denis Brutus, more immediately required in England with the cricket tour on the boil...""","","['rec5BR1dbaQ9phwSM']","[Dennis Brutus protests the Olympics (SANROC), 1977, London](apdp.event.000091)","[""apartheid"", ""protest"", ""demonstration"", ""Olympics"", ""sport""]"," - ","© Times Newspapers Limited.","['rechwnTuVjiT78SYL', 'recHgB7b83n47HnsY', 'rec6VCRP2EDAg7IHX', 'recdz56XXskzIC8zt', 'recopDLT1nzlNtZqa', 'recNobd5dHKvtIdPs']","True","[Brutus, Dennis Vincent](apdp.person.000779)|Poet;;;[Hennessy, John]()|Reporter;;;[Ganga, Jean-Claude]()|Politician;;;[Braun, Frank Dirceu]()|Politician;;;[Alexander, Reginald]()|Politician;;;[Ordia, Abraham]()|Politician","[""Brutus, Dennis Vincent""]","","1970",""
"","More arrested in South Africa (1975-09-17)","apdp.news.000059","More arrested in South Africa","News Report","1975-09-17","['rec3qJ9cAS12R9eSf']","[""The Times""]","p. 6","https://link.gale.com/apps/doc/CS101940529/GDCS?u=linc74325&sid=GDCS&xid=b7e858f9","GALE|CS101940529","2019-06-29","[""The Times Digital Archive""]","['recIReHwRKnt2RoPo']","Cape Town, Sept 16 -- At least four whites and an African have been detained under the Terrorism Act, in a new wave of arrests by South African security police.
The latest arrests are connected with the detention some weeks ago of Breyten Breytenbach, an Afrikaner poet, James Polley, a Cape Town University lecturer, and a number of student leaders.","","['recb4S5dmTk22UkrB']","[Arrests under the Terrorism Act](apdp.event.000053)","[""terrorism"", ""arrest"", ""jail"", ""imprisonment"", ""professor"", ""student"", ""protest""]"," - ","© Times Newspapers Limited.","['rec7rl494KPTZPDeW', 'recLCDX5bLckkhcbw']","True","[Breytenbach, Breyten](apdp.person.001295)|Poet;;;[Polley, James]()|Academic","[""Breytenbach, Breyten""]","","1970",""
"","Moscow Blows Hot and Cold on Co-existence (1960-12-11)","apdp.news.000571","Moscow Blows Hot and Cold on Co-existence","News Report","1960-12-11","['recd5QaydfA6Ls4RM']","[""The Sunday Times""]","p. 2","https://link-gale-com.libproxy.unl.edu/apps/doc/FP1800346120/STHA?u=linc74325&sid=bookmark-STHA&xid=9cc93c53","GALE|FP1800346120","2022-04-07","[""The Sunday Times Historical Archive,""]","['rec5hnSzuyYB34qhu']","""The ringing anti-American tone of the new communist manifesto has posed a  basic dilemma  for Soviet diplomatic policy.""","","","","[""politics"", ""colonialism"", ""postcolonialism"", ""decolonization"", ""jail""]","","© Times Newspapers Limited.","['recAbA4V3pL5t6mQY', 'rec4dUbmFJY27c70o']","True","[Lumumba, Patrice Hemery](apdp.person.000085)|Mentioned Poet;;;[Kalb, Marvin]()|Reporter","[""Lumumba, Patrice Hemery""]","","1960",""
"","Mr F. C. Slater (1958-09-04)","apdp.news.000054","Mr F. C. Slater","Obituary","1958-09-04","['rec3qJ9cAS12R9eSf']","[""The Times""]","p. 12","http://link.galegroup.com/apps/doc/CS203512612/GDCS?u=linc74325&sid=GDCS&xid=27ccd2b7","GALE|CS203512612","2019-06-27","[""The Times Digital Archive""]","['recIReHwRKnt2RoPo']","Mr. Francis Carey Slater, the South African poet, died on Tuesday at the age of 84, our Cape Town Correspondent reports. He was born in the Cape and educated privately at Lovedale. He joined the staff of the Standard Bank in 1899 and retired from the management of its Grahamstown branch in 1930. His poetry began to appear in 1905 and a selected edition with biographical introduction by Sir Robert Ensor was published by the Oxford University Press in 1947. Some of the poems in the book were obviously derivative, but others had force and originality from their blend of romantic, stoic, and satiric strains. He was deeply moved by the great themes of nature, character, and race in his native country. His Collected Poems was published last year. In 1925 he made an anthology, The Centenary Book of South African Verse, and his verse had appeared in The Times Literary Supplement.","[The Collected Poems of Francis Carey Slater (1957)](apdp.work.000111);;;[The Centenary Book of South African Verse, 1820-1925 (1925)](apdp.work.000112)","['recewRvac0GsLWCDx']","[Death of F. C. Slater](apdp.event.000052)","[""death"", ""funeral"", ""obituary"", ""publication"", ""collection"", ""nature"", ""race""]"," - ","© Times Newspapers Limited.","['recrulgCEvd6zq7ci', 'recL5iA84uatWjSgq']","True","[Slater, Francis Carey 'F. C.'](apdp.person.001128)|Poet;;;[Ensor, Robert Charles Kirkwood 'R. C. K.']()|Writer","[""Slater, Francis Carey 'F. C.'""]","","1950",""
"","Mr Hain aims for Springboks' Achilles heel (1969-11-09)","apdp.news.000200","Mr Hain aims for Springboks' Achilles heel","News Report","1969-11-09","['recJYmLVDlPm8L6E9']","[""The Sunday Times""]","p. 24","https://link.gale.com/apps/doc/FP1801683575/GDCS?u=linc74325&sid=GDCS&xid=d5e19721","GALE|FP1801683575","2019-12-17","[""The Sunday Times Historical Archive,""]","['rec5hnSzuyYB34qhu']","[Excerpt]: ""SUPPORT has snowballed beyond our wildest dreams,' says Peter hain, 19-year-old chairman of the Stop the Seventy Tour Committee formed recently to co-ordinate opposition, to next year's visit to Britain of the South African cricket team but now in the thick of the furore over the current Springbok rugger tour... It was through Denis Brutus, black South African president of SANROC (the South African Non-Racial Olympic Committee) that Hain met 22-year old Hugh Geach, a Reading University student in Soil Science who is now honorary secretary of STST. Brutus is one of the few activists now hounding the Springboks with first-hand knowledge of het grim realities of Apartheid...""","","['rec5BR1dbaQ9phwSM']","[Dennis Brutus protests the Olympics (SANROC), 1977, London](apdp.event.000091)","[""apartheid"", ""Olympics"", ""sport"", ""athlete"", ""protest"", ""racism"", ""prisoner"", ""prison"", ""arrest"", ""imprisonment""]"," - ","© Times Newspapers Limited.","['recGt1Bcppq1az6q9', 'rec0Sjv9CE27TCKRu', 'recP12BV0O2NC4ZIL', 'rec96nCNFIXKEyOkR', 'recczvqUPrZ27zaPy', 'recBCUyW4mWA4Yedz']","True","[Brutus, Dennis Vincent](apdp.person.000779)|Poet;;;[Moynihan, Michael]()|Reporter;;;[Hain, Peter Gerald]()|Politician;;;[Geach, Hugh]()|Civilian;;;[de Keyser, Ethel]()|Politician;;;|","[""Brutus, Dennis Vincent""]","","1960",""
"","Mr Okot p'bitek: Poet and commentator on African culture (1982-07-23)","apdp.news.000195","Mr Okot p'bitek: Poet and commentator on African culture","Obituary","1982-07-23","['rec3qJ9cAS12R9eSf']","[""The Times""]","p. 12","https://link.gale.com/apps/doc/CS203786999/GDCS?u=linc74325&sid=GDCS&xid=177bc5be","GALE|CS203786999","2019-12-17","[""The Times Digital Archive""]","['recIReHwRKnt2RoPo']","[Excerpt, Obituary] ""Mr Okot p'Bitek, Uganda's best known poet and a trenchant commentator upon contemporary culture in Africa, died on July 19. He was born in 1931 at Gulu in Acholiland Uganda, the son of a teacher...As a result his first major English language work, Song of Lawino (1966) blended modern satirical ironies into a verse form approximating to traditional Acholi poetry, a technique achieved by the author translating his own work into English from its vernacular. The related Song of Ocol, followed in 1970, with Song of Prisoner and Song of Malaya jointly winning the 1972 Kenyatta Prize for Literature. Okot's commitment to Acholi poetry and music is partly explained in the Horn of My Love (1974), a miscellany of poems in two languages with accompanying commentary...""","","['recdUGu4e76koJmUd']","[Death of Okot p'Bitek ](apdp.event.000051)","[""obituary"", ""death"", ""literature"", ""language""]"," - ","© Times Newspapers Limited.","['recEZQwteSK57Mkf1']","True","[P'Bitek, Okot](apdp.person.001284)|Poet","[""P'Bitek, Okot""]","","1980",""
"","Mr Roy Campbell's Death (1957-04-25)","apdp.news.000055","Mr Roy Campbell's Death","Obituary","1957-04-25","['rec3qJ9cAS12R9eSf']","[""The Times""]","p. 8","http://link.galegroup.com/apps/doc/CS136403097/GDCS?u=linc74325&sid=GDCS&xid=36bdb25a","GALE|CS136403097","2019-06-27","[""The Times Digital Archive""]","['recIReHwRKnt2RoPo']","Mr. Roy Campbell, the South African poet, who had lived for some years in Portugal, was killed, and his wife was injured, when a car in which they were returning from a fortnight's holiday in Spain crashed into a tree near Setubal on Monday night. Mrs. Campbell was taken to hospital.","","","","[""death"", ""funeral"", ""obituary"", ""accident""]"," - ","© Times Newspapers Limited.","['recZVbqqmIoa0w2Xy']","True","[Campbell, Roy](apdp.person.000514)|Poet","[""Campbell, Roy""]","","1950",""
